id|tweet
1057049795905302528|well give mani case studi display
1057778313572302848|          
1057421056762355712|hollow worldnew song14 album 
1057416330205372417|run blog websit look help nich plr content event add yo
1056688714632650752|sun goe down come play
1057055896294080512|bmx la villett  pari franc
1057411705020403717|top unlock websit right 14 day free trial card needed)
1057407829966024705|student recent grad look peopl join junior editori team appli
1056695873583964163|synthwav 80s music video  check  
1057783963308122112|greatest exercis music take hike mate
1057421855554818049|tue
1056696894192267265|n  happi sonday  far abba concern everyday son day love l
1057418371673673728|busi one
1056696377466646530| forev young  alphavill  web
1057783681778114560| wast  steve aoki bts  web
1057784102496149505|interest learn flute organis music workshop teacher encourag student
1057420960008151041|hello world meet two love
1057421498208735241|boogi bought lambo truck deserv also say two project way 
1057421607768076288|i sang leav leav gold leav gold                    song
1057059177074315270|featur
1057058774689767425|beauti grace alway make stupid face love
1056938419614609410|financ stock recommend
1056692105169563648|threw 3 td pass eagl defeat jaguar l
1057252046489800710|      influenc futur japan
1057059466833788928| 
1056593024808075266|time invest intellig softwar stock market shell signific market v
1057059337816997893|calm effect
1057765682111074304|fitbit share jump third sale
1057421484308791296|[denisecreekmore] sing live texa georg strait incred voic
1057421577350897664|kkbox wake
1057783973315788806|ep 1 out!!!!!pleas share like comment!hop enjoy much
1056920423156322305|3 aspect earn could impact ko stock
1057059083369545728| via
1056692756800856065|ugo zagato behind wheel one two produc 1932 v4 16 cylind finish gree
1057058802653126656|hello
1056697019442585602|ayer se luci en el   uno de nuestro de lujo cant junto l e
1057059204656062464|yoga medit
1057421222328160258|replac drummer
1057612260737273856|22 sketch make complic financi concept simpl enough fit napkin via
1057784195785912320|check two pair unus adult goalkeep glove bu1 storelli elit size 10
1057781744336654337|happi
1057421571025977344|host karaok night monday night would come
1057554035627175936|financ allow free capit valu stock awar su
1056672231642804226|ibm acquir red hat complet chang cloud landscap becom world hybrid cloud
1057421062403571712|deltaindi music label
1057421662923247621| meant   web
1057059252978630656|pink floyd high hope
1056919417395666944|new cours cover common use terminolog relat stock market busin
1057058832587862016|check les noce de jeannett stamp small cup  via
1057778974582099968|anoth amaz day around final incred cheer watch someth
1056696427445919754|respons de xito como cosa ms como cosa de la cumpl 55
1056526968861192192|big teacher richard wycoff specialist technic who among thing discov
1056601364380467200|method elliott wave analysi 
1057623767059517447|trump say today look good stock market
1057315399560249344|chop mode right realli see edg either way stay trade far
1056608184293560322|hyperion generat 1 million dapp becom largest public chain valuabl blockchain project
1057421186148249601|henri smile charlott would too sonyalpha
1056694121438593026|jornada 7 segunda divisin un encuentro igualado pero dond los hombr de hicieron con la victo
1056696641598570496|doobi doobi
1057410514936975360|lor de son audit philipp bana rappel le rle indispens des 1600 cts pour le de mai aussi dan
1057054775890534400|discov  
1057776128641904640|alway work colin sheehan see work qu
1057406697998876672|get readi eicma 2018recent improv high power electr 
1057058562827005952|indian villag indian villag stori 2 store owner toni miller continu journey
1056696522677633025|halfway music video meow girl
1057305537644249089|stock higher ahead facebook appl earn 
1057010084478361601|nice put current
1056696897484685313|director asif masoodup wahe
1057341396519211009|increas 2009
1057783779513823232|is thing inde love turn
1057059501986201601|better get falken speaker enter
1057008657152593921|stock market downgrad junk ahead crash
1056636669695164416|stone barrier stoc
1057252710121009154|          believ qualiti japanes c
1056554353119715329|twitter stock am)
1056696604365852673|lil wayn mona lisa kendrick lamar) instrument
1057410322758295553|young flee war torn countri play listen cope
1057671574860587008|trade today still 
1057561136416067585|stock asia most posit mainland chines stock saw rebound follow comment r
1056452468517810176|fd return also
1057420402643869701|aquafit benefit fit massag hydrotherapi one burn 500 calori session royal
1057053727977287680|nasc la e salut sostituisc la coniservizi il governo sceglier 
1056689862265487362|footbal saracen v leicest tiger premiership rugbi cup po
1056697015596470272|pick hit roll stone
1056697104763019265|two eighth nebula 1 note coaster
1057783606385369088|post new the way
1057058550101536769|caixa diz que estampou marca de graa e confirma valor para novo patrocnio que valer por quatro mese
1057620480331575296|el retorno del mercado acumula la mayor cada acumulada en un mes desd 2009 pesar de que el pib muestra una eco
1057251487758184450|   expens jp  make nikkei stock market price
1057059182598414337|offer alterc 
1057781058924658688|ranger move premiership despit draw kilmarnock ranger keep reli alfredo morelo
1056696877100531713| oct 31st  soul damn  avail store
1056912388010717185|daili dax stock analysi
1057059027094528000|attempt costum weekend
1057406799278567424|  titleist vokey wedg of!)     
1056684623256788993|open bank project collabor red hat deliv next generat open bank solut
1057783931695652864|keep relax ur enter 4 chanc 2 gorilla glass wee
1057059102042529793|get featur heard thousand find
1056946307351371776|inform technolog market mover red hat growth good exp
1057617352043327488|raven aerostar prospect bright despit risk octob 31 2018
1056593949958246400|tire know stock market simpl explan stock is stock
1056696333556477954|love guysstraight upthough road discourag keep
1057774120186904576|identifi best athlet potenti world
1057767650187714561|alreadi technolog place begin offer bet recreat learn make
1057413610354425856|reason run medal dsplay rack link bio
1056927874115100673|largest bank said monday profit jump 28 percent ye
1057419691726172160|ricordi del
1057059066718142464|est es un timbal soy percusionista domino toda la percusin pero de ste instrumento nace mi seudnimo paila
1057418727040471040|win can lose must never quit cameron trammel
1056692251009732608|perfect great
1056637983275843585|consist key invest 
1057050337838858240|wahrlich ein zweier toller mannschaften!packend schlagabtausch gnsehautatmosphr der
1057421813549019136| pompeii
1057407455699722241|para mucho el fin del para otro la de demostrar todo su
1057057748309995520|largentin  organis la premir amricain des personn de petit taill pour fair tair tout discrimin
1057250413597011968|    p6       wheat       2011yr
1057783639210110981| habit origin mix  movement  
1057421133748756480|bet top song help follow
1056696742949855232|michael ketigian spit bar web3 
1057783731275120641|great bring best soul chose playlist
1056696402011660289|noth
1056692024450183168|finger puls via
1057059006982905857| mr pinhorn  madrig   wow
1057059083541458944|heard dark chip trazworx via
1057784047005589505|american men stand line fi
1057657371374354432|microsoft stock rose
1056696878895521792|inner reason
1057784067167526912|joka beatztim tell instrument mixfre beat download download
1056696271212343296|usado para todo nada de nach
1057015807878803457|3 dividend stock beat tsx index ratio
1056696882456653824|massiv outpour thousand peopl share
1057059129091637249|winter registr 1 earli childhood class theatr la la land grade 1
1056689793143369729|continua la corsa solitaria della capolista juventus mentr il napoli vien bloccato sul pari dalla
1056621500516700162|first advanc exchang secur token merg atari x2 game next global block
1057050717930864640|race champion head latin
1056697059657433089| 20181029at
1057251830411849728|          cumul deficit japanes go
1057057540394098689|tenni tenni rolex pari master rolex pari nicola
1057646586409443328|bilibili stock jump announc japanes compani
1057407636885422081| la recherch dun le club du tinvit  venir dcouvrir et essay la lutt  
1057777749300076545|nike azawila
1056696630005641216|pleas let know want releas 
1057418776130568192|nomin come thick fast made nomin crown
1057051485748580352|[en rout pour les ] les inscript sont  rdv pour la 9e dition des jeux internationaux de la jeun
1057784242183106560|music relax enter 4 chanc 2 weekday
1057332404543807488|interview complimentari book latest thought stock
1057784234742607872|gryffin nobodi compar oliv x might
1056916971546124288|rcmalgo posit get muliday long cash month w
1057412824031547394|inktob day 30hanamichi sakuragi slam dunk unsuccess basketbal
1056932248803594242|continu key discuss call
1056697091744063488|send link goal much appreci one show love witho
1057421729377800192|research look submit journal learn
1057588214662397953|want bet bear market rafi farber may share
1056696934063333376|els fail get air guitar guitar  rememb music connect peopl
1057369869522558976|octob month stock market sinc 2008 begin great b
1057421647316205575|check fmg muney dre wild
1056622960495288321|ammbr global blockchain network develop public crowdsal singular exchang base
1057783871989780480|real onsoci yourown friend scrollpass
1056968943846506496|understand stock market enough make invest find today billi akaisha ka
1056911304898895873|daili nikkei225 stock analysi
1057058537795477504|atx safeti squat bar  verkauft nach
1057771850544111616|brighten
1056914028486897666|regenc center announc transfer nasdaq stock market regenc center announc transfer nasdaq stock market
