id|tweet
1057784065372254208|halloween yo halloween fun
1056689897506045957|lo mejor del te espera aqu en jagger con nuestra seleccin banda en vivo
1057420432100417537|enough get
1056688567252971521|top access site 14 day free trial card necessary)
1057059291872391169|increas visitor sale x100  traffic backlink youtub market seo =
1057309741230288896|stock market take littl paus say actual presid unit state america
1057571734923161602|sale lead consum product
1056669625121996801|ibm acquir red hat complet chang cloud landscap becom world hybrid cloud provid
1057048042317271048|match attax chelsea team
1057781615189929985| open site 14 day test run card needed) click
1057059308335255552|hand mom
1057054271399575552|me walk
1057279242755555328|werent yet worri stock market
1056696769994731520|p r e c   en por  
1057326042006913024|digit experi agenc manifesto join panopli thetechnolog servic group prepar float th
1057050902090047488|fail
1057783884719538176|aww yeah asap ferg ft lil yachti
1056554351597182977|web stock am)
1056895918962810881|nasdaq100 stock technic analysi
1057770805122207745|fun work first time chose them ctait gnial de travail avec ic
1057024306436292610|bed bath beyond constant increas 2009
1057420933185593345|rugbi le top 8 est vive le top 16
1057603245240139777|global market crash 2018 begin greatest financi crisi world ever
1057421844851109888|join us thursday
1057421886206951424|30 1985 pat benatar releas album hard
1056614307063050240|web stock pm)
1057779002323156992|lj work tri improv jump abil take also much whole sa
1057772733969375232|mode fr und freizeit
1056696963683491840|caldera trist 1977 
1057773015642071040|je isotoon
1057059362534027264| new xmas album john legend jessi j
1057418921488379909|world economi global stock market end biggest bubbl bubbl fuell unprec
1056942353150181376|new york stock exchang crisi 1914  
1056499081621594113|seem bpi stock trade got complic eat dividend cash time littl
1057059478166745089|song fall matteobocelli
1057058635283599360|song relax enter 4 chanc 2 gorilla glass
1057784028135211008|bewegta direct perform indic passag anim manner german equiv
1057421082037116928|made check humtap brand new hip hop approv
1057421280666939392|kromdraai famili farmpotji saturday 03
1057059451344117761|1
1057413559699808257|helmet  via
1057783994199068674|relax middl tough  enter 4 chanc 2 gorilla glass
1056626467621212160|coinbas could compet new york stock exchang nasdaq danni master say via
1057059406339301376|ensayando nuevo tema con 
1057778281968062465|horribl
1057054038133559296|red sox fan titl cheer choos yanke jeer
1056696805168009216|awesom night thecromerpi watch neildiamondshow thank guy
1056942068155604993|first task check stock see coach pick go place qualiti
1057011048644071424|quick stock market valuat back 
1057617708588494848|stock futur sharpli bounc back today might 
1057775284110405635|happi halloween trophecas 
1056605538593787905|strategi becom better
1056693735638085632|discov platform 
1057588375501320198|calvinayrenew want bet bear market rafi farber may share som
1056696650289373184|reader best red hot chili pepper song time moi
1057783753009971200|sabina beyli last forev
1057698051912069120|stock market lost dollar octob time load
1057421484065505281|watch one
1056690387006439424|elit access websit 14 day free trial card necessary)
1056696073622761472|live mix dj special j
1057414939009261568|saden 2019 la de sga diallo directeur gnral de noos com 
1057784227708710912|five men indict kill brother dj fiance
1057059239770779650|make beat periscop
1057420997412995073|next gig celebr 10 yr anniversari benefit great caus your town come
1057601237598769153|sprint stock gain revenu earn beat
1057768775548891136|hibernian boss neil lennon struck coin clash omin warn yob chuck pound
1057778753764503552|adjust equip step platform fit
1057753102789468162|stock market lost near trillion octoberoctob worst month 500 sinc septemb 201
1057052557963493377|unlock site 14 day free trial card required) click
1056696164161126400|world need love intend spread kind power music
1057059383631323136| midnight with love
1056688076448239620|hell yeah
1057308667048009728|health care market mover axogen good break bankruptci stock crus
1056696687362801665| marcador final vs  
1057784062037975040| sonando en   
1057784051438776320|one fave 2 enter 4 chanc 2 gorilla glass
1057251114494521344|    p9       sugar        2011yr 10328
1057782841810010112|roger 
1057421199725207552|happi halloween welcom samhain season safe fun make trick treat run around tonight
1056696630861283329|convinc twin would still choos
1057406772015706112|il passar deg anni non deve esser sinonimo di anch dopo 65 anni si pu svolger attivit fisica
1057413050335145984|3 day go elit ahlet centr hotel offici
1057420862788431873|na dies wochenend schon wenn sogar die auf der tenni spielen knnen schafft
1056697100136800256|happi 13th big bro kevin
1056912562703556609|stock winner loser nasdaq100
1057398204621299712|qu es la cmo
1057420965527863296|go vote
1056692977379278849|top open stream site without 14 day free trial card requir
1057420980665106432|encontro de irmo ser q vem som em temakinho
1057053741759762437|barbarian dumbbel 20 kg verkauft nach
1056921756584341509|stock rare dow declin lion air 737 max accid
1056660533594783750|ammbr reveal technolog wireless connect 5 mile
1056929529426522113|dont expect earn save stock
1057059198486306816|kkbox even
1057784156669857793|post kennedi stori instagram
1057784157663911937|here clip cover one day  happi halloween 
1057784092610125824|keep relax enter 4 chanc 2 w
1057058570112589824|via  
1057059249312940032|post new last kiss
1057775847476736000|hochsprung mnner thringer hallenmeisterschaft [anzeige]
1057778640891535360|filipino gymnast carlo yulo may miss medal alreadi made historyin world championship
1056640536524791811|trade moment invest
1057301733679001601|m30 long  entri reach last tim
1056606519335313411|hyperion build decentr map economi 10 billion peo
1056546335208415234|bakken shale oil stock belong top watch list [unabl retriev content] largest l
1056553699642916864|top stock search messag board am)
1056957761815277568|join line get new app give stock spend brand love
1057250175125643265|     p5       rice       2011yr
1057421794464935936|still free share whatev allow share here countri known egalit
1057421237264269313|chicago anybodi know taxi im tryna use one photo let know  
1057777980347465728|la team est en stand de au en regardez
1057734338597584896|market technic damag done stock market much wors
1057767660023205888|spectaculair une superb luxueus voitur de ne de la mythiqu au et
1056696899577745408|give imagin dragon whatev love adren
1057737179445821448|aig stock dip catastroph take toll earn
1057784215721467909|one time instrument cover jason derulo check full video
1056696347779190785|run low
1056688995567050753|best unlock  without 14 day test run card necessary) click
1057052996989845506|women play chang i would like chang
1056633896434130946|tomorrow market
1057773953375223808|tutti benefici fisica nei pazienti oncologici
1056688999912206336|best unlock  without 14 day test run card necessary) click htt
1057058677125861376|owl learn jive
1057048017059176455|barca barco hinchabl kayak bote bestway neva iii pesca campro embarcacion infla
1056696137879601152|new chase dream radio whiskey whiskey stream
1057059429185544192|yo devn x yogv flvm3
1057418489621766149|elit unlock site without 14 day free test card needed)
1057056222375890944|new cost resourc target
1057409439282745345|e kravic piegano il la di matteo de luca
1056659379448111104|first advanc exchang secur token merg atari x2 game next global blockchain techn
1056690080406851585|reit im derbi weiterhin auf
1056621279061663745|new stock analysi
1056697005081268225|check holiday gym
1056696760863621121|post new la vida se va
1057783719765917697|relax tough enter 4 chanc 2 weekd
1057776696676491264|half  popul live citi today!ris inequ major challeng
1057421697974845440|post new feel version
1057620359661449216|calcul motion heaven bodi mad isaac newton said lost
1057769296225538053|cycl schwinn herald road bike red
1056921238180745216|new cours cover common use terminolog relat stock market busi
1057421018111840256|noci azzurri b come sabato su rai 2 ko campo con
1057408668210249729|huuuug
1057775698293727232|great day deliv level 1 staff student
1057055697739833344|venerd 9 novembr alessandria via 71 presentazion del libro e della musica di patrick trentini
1057680917156782086|stock jump six month
1057058585849532416|prezidenti tonight 12 click  bio subscrib get notifiedsoon hit
1057047652972617735|inspir futur bass music video  check  
1057267341959016449|cannabi ignor wider stock market follow path
1056954118017871873|becom
1057410909537222656|cierra con broch de oro tu noch en compaa de tus amigo una cerveza bien fras en
1057057407564742656|hantelscheiben guss 50 mm 20,0 kg verkauft nach
1056973931171713025|hour reject upper trend line lot overhead suppli 102
1057775073145352192|durkin fire maryland day reinstat
1057658845130944514|money
1057058131870502912|elit openup  14 day test run card necessary) click
1056693400374775810|1 que le titr peut chapper 
1056929999708663809|avoid current risk stock bond market interview stockpuls
1057421565091033089|30 year plus u say
1057380708187103233|predict stock
1057357846575235074|peter rise interest rate collaps stock market
1057421827293790209|u rock salut
1057054766868676608|wicemistrzyni europi w biegu na 1500 metrw w intymnej rozmowi polsc mioci planach wstpienia
1056692980491333632|top open stream site without 14 day free trial card required) vi
1056686182422200321|fed need calm quantit tighten spook stock good thing
1057783645199568896| top 5 ladi gaga alli x taylor swift lana del rey via
1057415793145774080|silver medal espn wide world complex
1057421282487152640|post new how feat yascua
1057058612479057920|need real promot great price gimmick scam buy
1057057083277766656|critic need proactiv educ proud 400,000 canad
1057381665465491456|stock market fell went would risk there risk there return
1056694570908565504|close ex founder
1057418223077986304| meridian show  8pm 107 fm
1057414459684257794|token valu invest now miss
1057057616038248448|best openup site 14 day free trial card necessary) http
1057049553726332928|winter weaver brand around world look solut protect athlet
1056696572052996097|year ago semi seri equestria girl charact uniqu guitar design think remak
1057289496444747778|stock bond gold down
1057773507369672709|olivia gain profici 4 pass anoth level
1056696650469642242|make music enter 4 chanc 2 weekday 
1057784271908233216|music relax enter 4 chanc 2
1057059391696850944|song saturday night give listen second convers
1057059217633304576|openup site 14 day free trial card needed)
1056696174676185091|eddi henderson insid 1976
1057051557164920834|jeux de sur la candidatur de calgari
1057051006775652352|visit site get code new30
1056533492073422848|sweden bring forward launch digit currenc 
1056688563255951360|yuvaika diseado para por al997 859
1057634849131913218|call cover incred 2nd chanc 
1057783594645622785|blue  1
1057421689380880385|jack black tom morello honor dio annual bowl ronni event
1056901856029483010|millenni cover crash p5 12pm call today
1057012947384459264|stock market chase valu versus growth
1057783643224096768|say wish farewel
1057772828756455424|thank join us morn
1056916477696188418|great buy soon sign rebound buy low work 
1057782275616751616|exclus videow preview
1057420999229091842|let pick music song go make  vote top 8 8pm 
1057059426501361664|erica fall dream
1057421467128872960|thank kind word awesom job great turnaround time came frame onlin defin
1057734141356126208|come learn option come save  bank stock market opti
1057052208594931712|bet match join me game contest compet 8 million bether token prize
1057058866976972801|dude
1057782284642934784|maryland student plan protest dj durkin damon evan
1057783862606983168|tough time dont last tough team
1057272195121061889|psycholog risk learn control
1057361358084325382|stock market play bunge
1057058595416694785|post new 01  shaun legend mani time prod blacklightmus llc
1057421357737279488|  discov new trend music  app doubl music player  get app free
1057675009861267456|singl stock earn volatil highest sinc financi crisi
1056696848763809793|train drink
1057768638244155392|le est un domain la franc tous les atout pour tre championn
1057406928446459904|madden nfl 18 4)  via
1057783672722673664|quiet come home
1057784237535965184|tini invest fresh set qualiti string improv reviv ukulel learn
1057048633319796736|cest officiel organisera pour la deuxim foi les championnat du mond de voltig arienn
1057417499355107328|check new video  
1057784118111432704|workout relax ahead tough enter 4 chanc 2
1057296821540847616|bank made irrelev 2030 via
1057301095763136512|worri stock
1057770522627526656|excel long overdu even catch
1057048760818245632|tottenham manchest mahrez dedic goal leicest owner manchest riyad mahrez
1056625828929257472|stone stoc
1057760538527178752|econom financi stock market small  spanish languag     
1057058524973412352|"classic   the way feel""thi epic remain top 20 "
1057050719386304514|find way push away demon otherwis may chanc anyth
1057784075782475776|workout time hardstyl radio  best hardstyl 2018  music stream 
1056639728576094212|
1057052160054169600|pennamin postur patrol turf increas turgid  improv photosynthesi  increas wear toler  improv
1057417167216562176|know posit benefit play independ reinforc huge social health communiti bene
1056614105912692737|top stock search messag board pm)
1057059288122703872|bassa stereotyp accompani play keyboard instrument left chord alb
1057783089445904384|financ minist south korea say yes bank work crypto exchang
1056563544391598081|stock market crash ahead
1057059137228402688|check help fund real ingredi first album sean miller
1056691268238098434|turn enjoy elgo leader presenc  thank everyon 
1057052704982425601|get approv today new
1056696693322854400|brilliant cover!aretha franklin think cover stephani
1057058055316213760|lack talent made desir hustl give 110 percent zimmer
1057253303375949824|     sell japanes  like vultur          trend cheap  
1057354199577567232|financi exchang stock david alton clark icahn enterpris centurylink
1057059503601057793|big bro drop learn trap evey platform
1057419462721163265|week ride 10am sunris 2pm sunset  head back finland year get som
1057054923530084352|gilt medallion 1953 sledg 10068
1057403296871337984|inventori fund use busi season trade fluctuat carri high valu stock
1057783810711056384|surpris releas raw exclus patron via want access exclusi
1057759945838317569|clip make cent market
1057416129155661824|deux normand mdaill au championnat du mond master sur pistel bilan pour nos  est remarqu ca
1057784278300291072|wed
1057015974715711493|harvard growth margin improv equal strong stock appreci
1056696562871463936|post new unspoken word
1056696695294173184|carrer le bara met une manita historiqu au real et provoqu la destitut de men
1057056486977789957|gomor interest
1056630306801881089|hyperion dr isaac hyperion intend build decentr map economi 10 billion 
1057784152559243264|relax tough  enter 4 chanc 2 gorilla glass
1057048197091213313|recent help transform live find
1056689016572121089|yuvaika diseado para por al997 859 angi
1057783669664952320|miss london sermon  band u
1057783638702673920|time turn alot new thing stay tune
1057657229892112385|robinson increas 2008
1057783783066353664|happi get spirit tonight wear
1057421134684086272|incred music
1057776341393817600|carabao frank lampard lose return chelsea derbi tottenham eas past west ham arsenal advanc
1056920996974862338|hour strong open morn fail upper back chop stay thi
1057717164231163904|bullish pierc indusind 1431 easili take th stock last indusind
1057052534689488896|unlock site 14 day free trial card required) click h
1056696857211088896|charli wilson magic listen 
1057059367219064834|full version song channel
1057784168623546370|longer make music still materi make video song wrote coupl yrs ago call
1056696415383117825|express cannot said imposs victor hugo
1057421154418212865|ur playlist 2 help power tough give away 
1056696820024274945|kkbox wonder crazi b 2015 origin remast 
1056671423824039940|wow ibm strike deal buy red hat billion
1057783717593341952|theme song 
1056536322935058432|bakken shale oil stock belong top watch list [unabl retriev content] lar
1057769428379754496|casual para mujer ms modelo en
1057059221462757376|spent weekend record edit coupl novel hand
1057761886941429761|march key indic issu signal reduc stock risk
1056630457507422208|car paid cell phone plan stock option sound like great employe perk provid guid
1056526874808143872|specif elliott wave  
1057783840498991104|music lyric bamil gutierrez collado could chang world youstream live
1057784185438527489| yk kardelik olann beli bklr gnl   
1056676006550011904|sec approv hyperion exchang agre stellar crypto asset trade america first secur token exchang
1056696451768696832|miss alan new york philharmon new maestro dutchman jaap van plan f
1057421659437780992|crazi express pain
1057049995050995712|mi piac pensar che un giorno per qual strano virus che contag tutti) come questo saranno la normalit
1057784136948043776|keep relax ur audiobook enter 4 chanc 2
1057055758507036672|bbc editor apologis comment leicest citi crash victim caus 
1056919959102742528|real mean stock market
1057055253554757632|canadien noah juulsen  lentran apr avoir rat le dernier match
1056697009854447616|ana one girl deepli deepli  gave permiss share mirac
1056695473971486721|check highlight reel friday night
1056612487305551872|sec approv hyperion exchang agre stellar crypto asset trade america first secur
1057058616975462400|new banger 
1056688166311223296|hoy bailamo con daria chevotoba 
1057771524361519104|soccer  fan  
1056501713149005824|precis elliott wave 
1057414406370406400|would like afford way feedback way premiership intern here clic
1056694517728993281|happi monday
1056571183351676930|rigor elliott wave ftse mib dax 30
1057252500561027073|       addit jp fewer children age
1056693139413626881|carrer le bara met une manita historiqu au real et provoqu la destitut de
1057783870240837633|hear canario gaspar sanz bright fun classic song
1057412651708571650|giant kyle lauletta accus almost hit offic car
1057413137110974466|cant rev engin day expect sweet
1057769860011307010|foot di maria prolong de deux an au
1057754296756908032|golden financ bar growth 3d render
1057421560431235077|rdv ds demain ce soir minuit selon votr humeur ) pour le nouveau singl de 
1057344635713007616|wait pay tax restrict stock vest take
1057059344540467200|keep relax long  enter 4 chanc 2 eac
1057638149231267840|spruce point see dollarama stock price tumbl
1057421521847603201|swipe youd like hear moment forgot record mind left chap came
1057421432043388928|     one
1057783954625851392|formula 4 relax tough enter 4 chanc 2
1056696546388000768|piero umiliani atmospher
1056696452846632962|2
1057783853602033664|gran fiesta de halloween en de madrid con presentando gracia
1057421728920543234|go watch now illsidevisu present  latest video phone bill now via youtub 
1057421458064982017|mista silva reveal new mixtap darkest via
1056990387481575426|taken right bottom trendlin could good bounc take trade
1056696601601687552|today listen 2 get door ur workout follow 4 chanc 2
1057783865836744710|wws offer advic
1057769532151001088|musik kunst und unwichtig  fcher die spa machen
1056696519838105603|new fabucam seri featur erykah badu come soon 
1057251325761613836|  cheep jp  make nikkei stock market price
1057051322346725376|small island develop state meet samoa week pleas see new
1057640478399639552|gap long way close though
1057059500354609152|help u great music like enter 4 chanc 2 gorilla glass
1057414081341210624|seem reput caus high incid due natur easi u
1057408565340786688|goal al via la nuova edizion su sky dal 31 ottobr 2018  
1057420952609439745|primer tema del lbum dian grabado por chet baker paul bley en dinamarca en lose
1057059442640863232|make sure match energi jsky36
1057268193620881408|cover crash p6
1057058696809865217|still music video shootproduc ravensfilm product
1057421249725583360|would anyon better marin captur human great broadway reviv
1057417722953392128|world economi global stock market end biggest bubbl bubbl fuell unp
1056695107464790016|excit share latest addit golf bag charm sterl silver charm golf golf collecti
1056696252556025857|opera lirica creata da            alfredo catalani             la walli       breve interpretazion di
1057058656502505472|way song
1056912818526715910|500 rose
1057775751301398528|mani thank baro survey everyon work
1057775868762877952| [anzeige]
1057058885780078593|love work talent pls follow back guy rest gu
1057421788274192386|gang origin 
1056956554107346945|exchang rate signific
1057391892969734149|team look payrol analyst join team respons global payrol p
1057778888296804352|"upload new episod celt govan"""
1057783854335954945|new music releas surpris album get detail
1057374744843075587|arcon stock jump immin deal apollo global
1056440892918296576|5 scari reason stock market 
1057269322492641280|rough month  let quikfo leg work research past
1057780555104878594|app mani amaz featur help peopl everywher
1057784032254181376|happi wednesday back atkinson cc atkinson nh happi halloween
1057608149010661376|guid understand 
1056696234440884225|staff  pre
1057421424606896128|u relax tough enter 4 chanc 2 weekday
1057421644891852800|need ppl  let know listen
1057784074645970945| anoth 
1056660348814704640|ammbr global blockchain network develop public crowdsal singular exchang base laser st
1057421721135804416|hocus pocus come littl children me) full
1056696365441441793|2nd 
1057058567793057797|aum 59
1056589220284956678|want know stock market explan share stock is easi way
1057767881222578179|pronto narro viso por
1057305353677881349|armor rialzo sui profitti cent ad azion cresc allo stesso modo il titolo
1056689635387207680|en famill ce soir classico et demain pour 1 moi  et pas quel moi  1 moi
1057052209337253888|inaugur nos actu rseau nouvell faon de vos succ avec rejoindr le de
1057059216941309953|formula 4 tri medit enter 4 chanc 2
1057059450698121216|time never now recent releas solo singl 53 minut
1057059373900595200|brand new album digit platform sure check
1056688546193362944|allow creat type bet imagin set paramet odd thos
1057052930442878976|spent
1057777382189424641|mircol de pecho con hombro   
1057270105237843968|stock isnt faint
1057058765646782466|anoth screenshot anyon els use teach awesom
1057421102358630400|saturday situat esibayeni shisanya 
1056696644538896386|alway work
1057272462361149441|55 day christma time plan christma cash slow pay need purcha
1057279109758377985|mani employe grant stock option yet price often perceiv opaqu black opt
1057059372726050816|murs316
1057784094615003136|post new peepin eye
1057059241662599174|sell onlin check out
1057418261459955712|une seul ambit pour construir le premier cosystm indpend et automati pour c
1056696965726158849|music help 2 workout want sit follow 4 chan
1057047934074798080|parent young athlet measur  law averag winner minor
1057673566903328768|tax treasuri director matt cooper speak london stock exc
1057365274171719680|simpl secur trade
1057421531800842240|new music jezre3l check pursuit avail
1057296333537718274|algo get long discuss 12pm call today
1057783916705300480|bouta make chang
1057630932818059265|team consist world former chief scientist
1057057032245821440|present new stripe tape side leg  readi   check product
1057053769563865088|lopetegui vinc par le real madrid et
1057781396402397186|not interest photo food footbal team dinner tonight th
1057365386469957632|grubhub control market revenu juli accord edison trend follow uber eat
1057682262974705669|watch potenti breakout
1057620415026057216|hong kong stock exchang tap digit asset blockchain trial
1057771095447797763|team usa  battl becom fai drone race world champion  event live stream miss
1056691014860263424|chd kompakthanteln guss 50 kg verkauft nach 
1057776738866913280|monday   
1057421115373641728|rock expand
1057338474481831937|halloween might come earli year stock investor continu experi horrifi level volatil
1057780569575247872| 30 list playlist
1057058800593788928|float goat dj muggs) vinni paz pain collector)
1057058979635961856|drop nov 7th readi new preview 
1057527923715031042|chatq allow access stock market
1057783730511716353|chi mi segu su
1057058649972113408|las de espaa  estrenamo el mas recient music del  talento mundial de la bachata jordan quint
1057784198839390209|preview spooki ghostbust cover wooo
1057783977451241472|relax chill tough enter 4 chanc 2 gorilla glass
1057407569487187968|2018 nfl trade deadlin raider bronco score high mark dump amari cooper demaryius thoma
1057783816922775554|first track horror tape check  
1056696327202095107|check releas tripl stack  morn prayer listen
1057059293458022400|formul valverdeil donc russi  transform le barca en seulement 5
1057769954299338753|maryland fire coach dj durkin one day announc reinstat durkin reinstat pos
1056696558517936129|rais   po
1057404644895395841|wall street edg back help bargain hunter new york  major stock index post modest gain
1056693657749856258|strelci novog sada kikind prvaci srbije
1057421339248738304|refuge camp lauryn hill sweetest thing
1057412714522443776| una de corner pero difcil con ese tacn que descoloca todo de esa entrada perfecta de p
1056693558613340160|neme kadaja osvojili bronzu za srbiju na sp
1057058791915732992|relax ahead  tough  enter 4 chanc 2 gorilla glass
