tweet_id|datetime|city|state|country|gps|polygon|tweet
903022249954988036|2017-08-30 17:30:56|Knoxville|null|United States|null|(35.831436,-84.19397),(36.133505,-84.19397),(36.133505,-83.733713),(35.831436,-83.733713),|sounds better to me, since mexico helped us with katrina and are also trying to help with harvey yet, trump won't accept their help.
903022306678669312|2017-08-30 17:31:09|Warner Robins|Warner Robins, GA|United States|null|(32.495868,-83.728243),(32.669392,-83.728243),(32.669392,-83.554155),(32.495868,-83.554155),|i support the american red cross https://t.co/pcgh8vkra7 #hurricaneharvey #helpforhouston
903022738775924737|2017-08-30 17:32:52|Baltimore|Washington, DC|United States|null|(39.197211,-76.711521),(39.372215,-76.711521),(39.372215,-76.529443),(39.197211,-76.529443),|how sad is it that .@baltcogov is denying someone's request to volunteer to help .@fema teams deploying to help hurricane harvey recovry? /1
903022761857007617|2017-08-30 17:32:58|Broomfield|Broomfield, Colorado |United States|null|(39.894185,-105.147267),(40.000314,-105.147267),(40.000314,-104.997195),(39.894185,-104.997195),|'we were already so scared': houston immigrants fear accessing emergency help during harvey #harvey   https://t.co/ouq5aqassw
903022762003906560|2017-08-30 17:32:58|Los Angeles|Venice, CA|United States|null|(33.704538,-118.668404),(34.337041,-118.668404),(34.337041,-118.155409),(33.704538,-118.155409),|race and class are the biggest issues around hurricane harvey and we need to start talking about them https://t.co/lcmpxvzk30 via @theroot
903022930015244288|2017-08-30 17:33:38|Andover|Andover, MA|United States|null|(42.598237,-71.255046),(42.700233,-71.255046),(42.700233,-71.075953),(42.598237,-71.075953),|#bostonstrong help #houstonstrong #hurricaneharvey, goto @redcross https://t.co/16azikxcis or text word harvey to 90999 to make $10 donation
903022954404921344|2017-08-30 17:33:44|Los Angeles|Venice, CA|United States|null|(33.704538,-118.668404),(34.337041,-118.668404),(34.337041,-118.155409),(33.704538,-118.155409),|race & class are the biggest issues around hurricane harvey and we need to start talking about them https://t.co/lcmpxvzk30 [ht @jensinkler]
903022977553506304|2017-08-30 17:33:49|Tempe|Tempe, AZ|United States|null|(33.319945,-111.979047),(33.465823,-111.979047),(33.465823,-111.877237),(33.319945,-111.877237),|we are now accepting financial donations on behalf of the red cross to help those impacted by hurricane harvey.… https://t.co/nupxpcg5e1
903023071623356416|2017-08-30 17:34:12|Houston|Houston, TX|United States|null|(29.522325,-95.823268),(30.154665,-95.823268),(30.154665,-95.069705),(29.522325,-95.069705),|which shelters need hot meals. we have hot food to deliver. #harveyrelief #harveyrescuepage  #harveyrescue
903023102791168000|2017-08-30 17:34:19|Houston|Houston, TX|United States|null|(29.522325,-95.823268),(30.154665,-95.823268),(30.154665,-95.069705),(29.522325,-95.069705),|so many need our assistance. please rsvp to volunteer & help us with hcrp's hurricane & flood relief.… https://t.co/mayfl7qr7n
903023206453227520|2017-08-30 17:34:44|Los Angeles|NY/LA/Palm Springs|United States|null|(33.704538,-118.668404),(34.337041,-118.668404),(34.337041,-118.155409),(33.704538,-118.155409),|text love to 20222 to aid #hsus in their animal rescue efforts for #hurricaineharvey #houstonfloods #harveyflood #harveyrelief 🙏🏼😥❤️
903023342587916288|2017-08-30 17:35:16|McAllen|null|United States|null|(26.143437,-98.295824),(26.337943,-98.295824),(26.337943,-98.195525),(26.143437,-98.195525),|@whataburger i've seen pics of the harvey crisis but this one is special to me 😭😭😭
903023425463209984|2017-08-30 17:35:36|Farragut|null|United States|null|(35.806025,-84.241116),(35.917782,-84.241116),(35.917782,-84.119998),(35.806025,-84.119998),|donated $20 today to help the victims of harvey in texas. seeing the images of all the work rescuers have done is inspiring. #houstonstrong
903023553460658177|2017-08-30 17:36:07|Seattle|Tacoma, WA|United States|null|(47.495315,-122.436232),(47.734319,-122.436232),(47.734319,-122.224973),(47.495315,-122.224973),|i will never stay in a holiday inn again. how can you not help a family in need because they have 3 dogs?!?!😠😠😠 #boycottholidayinn #harvey
903023654912516097|2017-08-30 17:36:31|Boston|null|United States|null|(42.227797,-71.191421),(42.399542,-71.191421),(42.399542,-70.986004),(42.227797,-70.986004),|"it's so amazing to me that #mexico is sending help when our ""president"" consistently disrespects & tries to build a wall #hurricanharvey"
903024011365335040|2017-08-30 17:37:56|Miami|Miami Beach, Fl|United States|25.79265318,-80.1892626|(25.70904,-80.321683),(25.855667,-80.321683),(25.855667,-80.144974),(25.70904,-80.144974),|no excuse everyone can donate to hurricane hurricane harvey victims #helpharveyvictims @ publix… https://t.co/wjs3sersat
903024103145254914|2017-08-30 17:38:18|Winston-Salem|Winston-Salem, NC|United States|null|(35.934126,-80.389019),(36.240211,-80.389019),(36.240211,-80.100949),(35.934126,-80.100949),|i somehow managed to miss this yesterday. https://t.co/ibelnvkteo  #hurricaneharvey #evacuation #helpforall #doingtherightthing #askforhelp
903024329893564416|2017-08-30 17:39:12|Boston|null|United States|null|(42.227797,-71.191421),(42.399542,-71.191421),(42.399542,-70.986004),(42.227797,-70.986004),|"incredible that #mexico is still sending help when our ""president"" consistently disrespects & tries to ""build a wall"" #hurricaneharvey"
903024518712745984|2017-08-30 17:39:57|Bay Area Fellowship - Broadcast Campus Corpus Christi|texas yall|United States|null|(27.692344,-97.44976),(27.692344,-97.44976),(27.692344,-97.44976),(27.692344,-97.44976),|church unlimited broadcast campus is in need of canned goods. come by and we will go to unload your donations for you! pls rt #harveyrelief
903024580779941888|2017-08-30 17:40:12|Irvine|null|United States|null|(33.606077,-117.86894),(33.773387,-117.86894),(33.773387,-117.695781),(33.606077,-117.695781),|hurricane katrina survivors are probably pissed as hell they didn't receive this much help n attention lol
903024605236834305|2017-08-30 17:40:17|San Diego|San Diego|United States|null|(32.53962,-117.282538),(33.080404,-117.282538),(33.080404,-116.92744),(32.53962,-116.92744),|trump is only interested in sending aid to texas to the extent it helps him in the polls, he is that crass. #hurricaneharvey
903024717946388481|2017-08-30 17:40:44|Brownsville|Brownsville, TX|United States|null|(25.858723,-97.580085),(26.085488,-97.580085),(26.085488,-97.374767),(25.858723,-97.374767),|seeing all these donation drop off locations off the express way in brownsville tx is a great sight to see. texans helping texans! #harvey
903024753203707904|2017-08-30 17:40:53|Boston|null|United States|null|(42.227797,-71.191421),(42.399542,-71.191421),(42.399542,-70.986004),(42.227797,-70.986004),|donate to families affected by #hurricaneharvy ! this gofundme helps families get furniture back for their homes: https://t.co/ash6mfuezk
903024884107837442|2017-08-30 17:41:24|Bawcomville|Currently without a map |United States|null|(32.456823,-92.193077),(32.485022,-92.193077),(32.485022,-92.142376),(32.456823,-92.142376),|family in bawcomville share their experience driving to texas to help out those affected by #hurricaineharvey. watc… https://t.co/pfe7d3crhu
903024907608576000|2017-08-30 17:41:30|Cinco Ranch|Katy, TX |United States|null|(29.676113,-95.846367),(29.767865,-95.846367),(29.767865,-95.711056),(29.676113,-95.711056),|a big need for pet supplies and crates for hurricane pets! drop off at katy mills 5a parking! #katystrong #katytx https://t.co/7vc58bgo1p
903024953414561793|2017-08-30 17:41:40|Manhattan|null|United States|null|(40.683935,-74.026675),(40.877483,-74.026675),(40.877483,-73.910408),(40.683935,-73.910408),|@dominick_leon @correctthemedia i'm not sure what politics has to do with people helping after a hurricane
903024960800780288|2017-08-30 17:41:42|Garland|Dallas, TX|United States|null|(32.829815,-96.706144),(32.985469,-96.706144),(32.985469,-96.537124),(32.829815,-96.537124),|i rest easy knowing @gregabbott_tx and the tx gop won't learn anything from #hurricaneharvey and pass new regs that could help.
903025098092896257|2017-08-30 17:42:15|Little Rock|Diocese of Dallas|United States|null|(34.62595,-92.521595),(34.817822,-92.521595),(34.817822,-92.163049),(34.62595,-92.163049),|our prayers are large and ongoing for fellow texans suffering from #hurricaneharvey. please help as you can:… https://t.co/g98vhevuwn
903025122285502464|2017-08-30 17:42:21|Provo|Utah, USA|United States|null|(40.18565,-111.740949),(40.311641,-111.740949),(40.311641,-111.602629),(40.18565,-111.602629),|#portarthur #beaumont #vidor #nederland #lumberton #texas #harvey #help #texasfloods #flooding #rescues #cajunnavy… https://t.co/xutmzwrrig
903025158721556480|2017-08-30 17:42:29|Brooklyn|NYC|United States|null|(40.570842,-74.041878),(40.739434,-74.041878),(40.739434,-73.855673),(40.570842,-73.855673),|trump didn't witness shit about harvey, why does he feel the need to lie about things that can be checked immediately?
903025281530830848|2017-08-30 17:42:59|Houston|Katy, Texas|United States|null|(29.522325,-95.823268),(30.154665,-95.823268),(30.154665,-95.069705),(29.522325,-95.069705),|to help us meet the needs of those affected in our community by #hurricaneharvey visit: https://t.co/v1qmxwbuxm… https://t.co/yh63ehggi4
903025345661616128|2017-08-30 17:43:14|Laguna Niguel|SoCal|United States|null|(33.487223,-117.740002),(33.571675,-117.740002),(33.571675,-117.672617),(33.487223,-117.672617),|does the u.s. need to be more prepared for catastrophic floods? https://t.co/kkrmbgfusz #harvey2017 #harveyflood #hurricaneharvey
903025392767959040|2017-08-30 17:43:25|Grapevine|Grapevine, TX, USA|United States|32.93062323,-97.07595548|(32.878571,-97.129669),(32.985097,-97.129669),(32.985097,-97.029639),(32.878571,-97.029639),|did my part ❤️ to help those affected by #hurricaneharvey2017 #givebloodsavelives @ grapevine… https://t.co/crdfnye1fy
903025484669231104|2017-08-30 17:43:47|Provo|Utah, USA|United States|null|(40.18565,-111.740949),(40.311641,-111.740949),(40.311641,-111.602629),(40.18565,-111.602629),|#mormonhelpinghands, catholic charities & others have hotline numbers: 800-451-1954 or 844-965-1386 #harvey #floods… https://t.co/wg2reqo2ge
903025542110347264|2017-08-30 17:44:01|St Paul|Saint Paul MN|United States|null|(44.890752,-93.207783),(44.992279,-93.207783),(44.992279,-93.003514),(44.890752,-93.003514),|@phyllisnagy @bestfriends thank you for this! i've been looking for a way to help the animals affected by harvey.
903025695999352832|2017-08-30 17:44:37|Manheim|Manheim, PA|United States|null|(40.152845,-76.411829),(40.176812,-76.411829),(40.176812,-76.379298),(40.152845,-76.379298),|https://t.co/prbmxs7txs my friend needs donations now please for a hotel room !she has a 7month old baby girl. anything helps #harveyrelief
903025839234838528|2017-08-30 17:45:12|St Pete Beach|St Pete Beach, FL|United States|null|(27.682506,-82.7604),(27.758631,-82.7604),(27.758631,-82.725347),(27.682506,-82.725347),|@realdtrump2016 just what the country needs, tax breaks to pay for harvey
903025978322112514|2017-08-30 17:45:45|Florida|null|United States|null|(24.396308,-87.634643),(31.001056,-87.634643),(31.001056,-79.974307),(24.396308,-79.974307),|@pahubb43 at least the foundation won't be getting any government contracts to help harvey victims. thank god for @potus
903026001747132416|2017-08-30 17:45:50|Houston|Houston, Texas|United States|29.7350006,-95.3748322|(29.522325,-95.823268),(30.154665,-95.823268),(30.154665,-95.069705),(29.522325,-95.069705),|donations for #harvey evacuees.  children's items especially food needed.  open until 10pm.… https://t.co/ha6osiae8e
903026076166701056|2017-08-30 17:46:08|Provo|Utah, USA|United States|null|(40.18565,-111.740949),(40.311641,-111.740949),(40.311641,-111.602629),(40.18565,-111.602629),|☎️281-464-4851 coast guard # of beaumont & port arthur  #beaumont #portarthur #texas #harvey #help #coastguard… https://t.co/a9wybrfuox
903026275937382401|2017-08-30 17:46:56|Mayfield Heights|41.0710 N,81.5101 W|United States|null|(41.500849,-81.474912),(41.533113,-81.474912),(41.533113,-81.43201),(41.500849,-81.43201),|s/o to verizon for pledging $10 million to help those effected by hurricane harvey!! wow!!
903026328542347268|2017-08-30 17:47:08|Arlington|Aggtown, TX |United States|null|(32.586565,-97.233811),(32.817135,-97.233811),(32.817135,-97.037464),(32.586565,-97.037464),|celebs are so quick to hop on these tax benefits donations to hurricane harvey probably provides but kudos to them tho for helping.
903026475825291269|2017-08-30 17:47:43|Manhattan|New York, NY|United States|null|(40.683935,-74.026675),(40.877483,-74.026675),(40.877483,-73.910408),(40.683935,-73.910408),|happy to report parents & sister were not damaged during the hurricane & have mobilized today to volunteer/donate/help friends & neighbors
903026532624551936|2017-08-30 17:47:57|Brooklyn|Brooklyn, NY|United States|null|(40.570842,-74.041878),(40.739434,-74.041878),(40.739434,-73.855673),(40.570842,-73.855673),|helping them stay dry...join me in supporting the texas diaper bank! #harvey2017  #harveyrelief  https://t.co/ofrtoebf7t
903026547120013312|2017-08-30 17:48:00|Austin|Austin, TX|United States|null|(30.127892,-97.928935),(30.518799,-97.928935),(30.518799,-97.580513),(30.127892,-97.580513),|join us for a charity stream tonight to help with hurricen harvey relief! https://t.co/cpko52a9ts
903026577776234496|2017-08-30 17:48:08|Washington|Washington, DC |United States|null|(38.801826,-77.119401),(38.99538,-77.119401),(38.99538,-76.909396),(38.801826,-76.909396),|part of reason federal response for harvey good is fema staffed up-lesson learned their-fill out needed political appointments now!
903026651050717184|2017-08-30 17:48:25|Indianapolis|paradise|United States|null|(39.631677,-86.348441),(39.927448,-86.348441),(39.927448,-85.937404),(39.631677,-85.937404),|(quick read) - how a warmer climate helped shape harvey https://t.co/u8mrdzqa8t
903027023232323584|2017-08-30 17:49:54|Corpus Christi|Corpus Christi,Tx|United States|null|(27.578509,-97.662618),(27.895793,-97.662618),(27.895793,-97.202232),(27.578509,-97.202232),|yeah, exactly, i don't see any of those assholes or blm down here in texas helping out in the hurricane relief, f*c… https://t.co/gxcyi0kihv
903027058481221632|2017-08-30 17:50:02|Greenwood|Indianapolis IN|United States|null|(39.529358,-86.25064),(39.636719,-86.25064),(39.636719,-86.040001),(39.529358,-86.040001),|folks on se coast need to keep a very close eye on #irma as it has potential to be a very strong hurricane. eps mem… https://t.co/tjg5lcpf6l
903027197878960129|2017-08-30 17:50:36|Cambridge|Cambridge, MA|United States|null|(42.352429,-71.160356),(42.403966,-71.160356),(42.403966,-71.064398),(42.352429,-71.064398),|"looking to help houston and other #harvey2017 affected areas? look no further b/c he thinks about ""...all the surro… https://t.co/6zoh6yzmid"
903027262295040002|2017-08-30 17:50:51|Argyle|Texas, USA|United States|null|(33.10796,-97.257334),(33.153965,-97.257334),(33.153965,-97.174977),(33.10796,-97.174977),|@joelosteen greedy bastard.  fake as the church you're protecting, instead of helping #harvey victims.  #joelosteendoesntcareabouthouston
903027275985297410|2017-08-30 17:50:54|Houston|Houston Texas|United States|null|(29.522325,-95.823268),(30.154665,-95.823268),(30.154665,-95.069705),(29.522325,-95.069705),|this one free app is helping saves the lives of hurricane harvey victims https://t.co/tjdcvc1fqn via @metrouk
903027599940702208|2017-08-30 17:52:11|Texas|null|United States|null|(25.837092,-106.645646),(36.500695,-106.645646),(36.500695,-93.508131),(25.837092,-93.508131),|@jjwatt thank you for helping harvey flood victims!
903027724876365824|2017-08-30 17:52:41|Los Angeles|Los Angeles|United States|null|(33.704538,-118.668404),(34.337041,-118.668404),(34.337041,-118.155409),(33.704538,-118.155409),|@dakayvakid lost pretty much everything in the hurricane. he’s an awesome artist and could use a little help. https://t.co/sgxr6zzxnu
903027736595374080|2017-08-30 17:52:44|Texas|HQ in ATX|United States|null|(25.837092,-106.645646),(36.500695,-106.645646),(36.500695,-93.508131),(25.837092,-93.508131),|help with #harveyrelief from anywhere. 25,000+ favor runners are ready to deliver supplies & food to texans in need. https://t.co/yddujzvaij
903027820699332608|2017-08-30 17:53:04|West Point|Mississippi|United States|null|(33.579149,-88.681757),(33.635583,-88.681757),(33.635583,-88.615941),(33.579149,-88.615941),|a poignant reminder. #harveyrelief #helphouston https://t.co/mibivnzhpy
903027850416185344|2017-08-30 17:53:11|Wichita|Wichita, KS|United States|null|(37.562483,-97.534906),(37.80531,-97.534906),(37.80531,-97.152924),(37.562483,-97.152924),|trump needs to just forget about the wall and to save face he can even blame it on the hurricane. the money is gone now. used for fema.
903027856841814016|2017-08-30 17:53:13|Massachusetts|Cambridge, MA|United States|null|(41.187054,-73.508143),(42.886824,-73.508143),(42.886824,-69.858861),(41.187054,-69.858861),|our thoughts are with the victims of #hurricaineharvey 🙏🌀 here are official ways to help if you are able. #harvey… https://t.co/kjbpxuqeoy
903027867528957954|2017-08-30 17:53:15|Heber Springs|Arkansas, USA|United States|null|(35.476271,-92.063582),(35.535795,-92.063582),(35.535795,-91.995706),(35.476271,-91.995706),|is there so much hatred in hollywood that no one will help the victims of harvey??!!
903028036546809856|2017-08-30 17:53:56|Hattiesburg|Hattiesburg, MS|United States|null|(31.241189,-89.427669),(31.380085,-89.427669),(31.380085,-89.248409),(31.241189,-89.248409),|this was my phone today. crazy. things are fine. please help those in tx impacted by harvey. https://t.co/wpjqy9gozz
903028048035020800|2017-08-30 17:53:58|Missouri City|Plottin🙇🏽🤐|United States|null|(29.506247,-95.586805),(29.642322,-95.586805),(29.642322,-95.431045),(29.506247,-95.431045),|click here to support hurricane harvey t-shirts made to help benefit those who were affected in h... https://t.co/gqb6uh49ig via @boosterllc
903028151210704896|2017-08-30 17:54:23|Montréal|Planete Redeyef |Canada|null|(45.410095,-73.972965),(45.705566,-73.972965),(45.705566,-73.473085),(45.410095,-73.473085),|#trump qu'il commence par venir en aide à ses citoyens plutôt que de gaspiller des millards en déclenchent une nouvelle guerre #harveystorm
903028157116239872|2017-08-30 17:54:24|Labelle|Labelle, FL|United States|null|(26.736572,-81.465813),(26.769311,-81.465813),(26.769311,-81.421531),(26.736572,-81.421531),|"@chucktodd ""no hurricanes named chuck or todd"" made me laugh out loud.  thanks!  i needed humor today.  😎"
903028159892922368|2017-08-30 17:54:25|Oak Ridge North|Burbank, CA|United States|null|(30.076095,-95.452477),(30.173617,-95.452477),(30.173617,-95.349469),(30.076095,-95.349469),|donated to those in need in my hometown #hurricaneharvey https://t.co/n5nxkjhjfy
903028499535073281|2017-08-30 17:55:46|Topeka|Topeka, KS|United States|null|(38.971524,-95.809606),(39.103634,-95.809606),(39.103634,-95.571859),(38.971524,-95.571859),|live at 6 from 29/urish dillons - @ralphhipp on how you can help @redcross and @wibwtiernan on how harvey has ⛽️ 💵 👆🏼
903028571450560518|2017-08-30 17:56:03|Fruitville|Sarasota, FL|United States|null|(27.308449,-82.497617),(27.357842,-82.497617),(27.357842,-82.440429),(27.308449,-82.440429),|easy way to help #houston #hurricaneharvey flood victims. buy from list via link below; ships to dallas law firm. t… https://t.co/j94f66knne
903028730221785089|2017-08-30 17:56:41|Queens|New York|United States|null|(40.541722,-73.962582),(40.800037,-73.962582),(40.800037,-73.699793),(40.541722,-73.699793),|i can't help but root for the astros against matt harvey this weekend.
903028732025241600|2017-08-30 17:56:41|Scranton|Pennsylvania, USA|United States|null|(41.369442,-75.719751),(41.469377,-75.719751),(41.469377,-75.617789),(41.369442,-75.617789),|katrina. sandy. harvey. what more proof do we need? https://t.co/fmlkkdv1l7
903028942562525184|2017-08-30 17:57:32|Austin|Austin, TX|United States|null|(30.127892,-97.928935),(30.518799,-97.928935),(30.518799,-97.580513),(30.127892,-97.580513),|@2017_harvey we @treehouseonline are meeting as a team tonight to discuss all possible options for helping and supp… https://t.co/5oawxb1trd
903028950900736001|2017-08-30 17:57:34|Downtown Jacksonville|Jacksonville, FL|United States|30.32633066,-81.65339546|(30.320695,-81.667378),(30.33406,-81.667378),(30.33406,-81.6461),(30.320695,-81.6461),|help coming! usskearsarge w/ marines from 26thmeu & ussoakhill to get underway tomorrow to support harvey… https://t.co/0fmb0umajq
903029006219583491|2017-08-30 17:57:47|South Windsor|United States|United States|null|(41.79827,-72.640011),(41.883553,-72.640011),(41.883553,-72.497201),(41.79827,-72.497201),|@madmoneyoncnbc so 500k cars gone , down south from #hurricaneharvy why. it $f or $gm demand will be there?
903029202517073921|2017-08-30 17:58:34|Los Angeles|West Athens, CA|United States|null|(33.704538,-118.668404),(34.337041,-118.668404),(34.337041,-118.155409),(33.704538,-118.155409),|more than 20 texas representatives and senators voted against sandy aid. how will they vote on harvey? https://t.co/zald7x9rfm karma?
903029225233502208|2017-08-30 17:58:39|Plantation|AMERICA |United States|null|(26.088262,-80.330201),(26.160753,-80.330201),(26.160753,-80.196833),(26.088262,-80.196833),|@rlc265 @kegan05 @kylegriffin1 total nonsense.disaster aid &response 4harvey by this president is 2nd 2none.the wal… https://t.co/22hrjarkcx
903029271287009284|2017-08-30 17:58:50|Dallas|null|United States|null|(32.620678,-96.977527),(33.019039,-96.977527),(33.019039,-96.54598),(32.620678,-96.54598),|leadership through stewardship! please consider donating to those effected by hurricane harvey, anything helps!!… https://t.co/mlowy7g1ec
903029313510899712|2017-08-30 17:59:00|Summerlin South|Las Vegas|United States|null|(36.082837,-115.355825),(36.159081,-115.355825),(36.159081,-115.314862),(36.082837,-115.314862),|what is the general explanation for praying to a god who has power to help, but didn't use it to stop the hurricane? maybe even planned it?
903029367864827904|2017-08-30 17:59:13|Colorado|Telluride, CO|United States|null|(36.992427,-109.060257),(41.003445,-109.060257),(41.003445,-102.041524),(36.992427,-102.041524),|i think i've cried 2719171 times seeing selfless acts from people all over the country coming to help out in the aftermath of harvey
903029477382529024|2017-08-30 17:59:39|Boca Raton|1200 Yamato Rd, Boca Raton, FL|United States|26.3938007,-80.1115189|(26.320692,-80.203991),(26.427259,-80.203991),(26.427259,-80.065981),(26.320692,-80.065981),|this says it all! hurricane harvey food and supply drive!🥊🥊🐕🐩🐈🐱please share ! please help all of… https://t.co/epzwfkedjy
903029545846132736|2017-08-30 17:59:55|Dallas|Dallas, Texas|United States|null|(32.620678,-96.977527),(33.019039,-96.977527),(33.019039,-96.54598),(32.620678,-96.54598),|as if i needed another reason to love @whataburger. #harvey https://t.co/nphn0bcbez
903029577144045568|2017-08-30 18:00:03|Mount Vernon|null|United States|null|(38.697083,-77.140882),(38.747275,-77.140882),(38.747275,-77.072778),(38.697083,-77.072778),|"""service above self."" thank you, @mattressmack. #harvey #helpforhouston"
903029616675131392|2017-08-30 18:00:12|Sacramento|Sacramento, CA|United States|null|(38.43792,-121.576613),(38.685524,-121.576613),(38.685524,-121.362715),(38.43792,-121.362715),|de'aaron fox and justin jackson discuss hurricane/tropical storm harvey #helpforhouston  watch now:… https://t.co/wnjk7xygbd
903029647134269441|2017-08-30 18:00:20|Wisconsin|Wisconsin, USA|United States|null|(42.491921,-92.889433),(47.309715,-92.889433),(47.309715,-86.24955),(42.491921,-86.24955),|seeing the #country come #together to help #texas is #heartwarming #gousa #hurricaneharvey
903029662439407623|2017-08-30 18:00:23|Queens|Far Rockaway Beach, NY 11691|United States|null|(40.541722,-73.962582),(40.800037,-73.962582),(40.800037,-73.699793),(40.541722,-73.699793),|https://t.co/mzylgbkws3  #floodvictims of #hurricaneharvey in #stateoftexas needs #help / any #donations you're… https://t.co/svifqcrwdo
903029905042104320|2017-08-30 18:01:21|Nashville|Nashville TN ✈️ MB Canada 🇨🇦|United States|null|(35.994568,-87.022482),(36.405448,-87.022482),(36.405448,-86.560616),(35.994568,-86.560616),|watching people come together to help each other in the midst of this flooding is a beautiful thing! ❤️#harveyrelief
903030016635584512|2017-08-30 18:01:48|Picnic Point|Lynnwood, WA|United States|null|(47.82599,-122.336551),(47.89362,-122.336551),(47.89362,-122.245495),(47.82599,-122.245495),|god bless mcdonalds & other businesses for helping victims of harvey & first responders. thank god for the goodness that is america!
903030030225297409|2017-08-30 18:01:51|Conroe|The Woodlands, TX|United States|null|(30.23105,-95.679001),(30.443978,-95.679001),(30.443978,-95.397267),(30.23105,-95.397267),|for those in need following hurricane harvey, oak ridge hs will be giving out supplies and other necessities tomorr… https://t.co/6h7hqclhgh
903030048474746880|2017-08-30 18:01:55|South Lebanon|null|United States|null|(39.339012,-84.243825),(39.3842,-84.243825),(39.3842,-84.148162),(39.339012,-84.148162),|jim mcingvale thank you for your generosity in helping texas hurricane victims. you are a true hero.rt
