tweet_id|datetime|city|state|country|gps|polygon|tweet
902960546064019456|2017-08-30 13:25:45|Port Arthur|eastside of patx|United States|null|(29.823923,-94.053284),(29.979166,-94.053284),(29.979166,-93.858553),(29.823923,-93.858553),|see why i keep getting frustrated? people are trying to help y'all aren't giving complete information #portarthur #harveysos
902960597968531463|2017-08-30 13:25:57|Texas|Houston, TX area|United States|null|(25.837092,-106.645646),(36.500695,-106.645646),(36.500695,-93.508131),(25.837092,-93.508131),|houston food bank reopens after harvey, needs volunteers and donations https://t.co/fgpcyppavs #hurricaneharvey @houstonfoodbank
902960950063624193|2017-08-30 13:27:21|Toronto|Toronto, Canada|Canada|null|(43.403221,-79.639319),(43.855401,-79.639319),(43.855401,-78.90582),(43.403221,-78.90582),|@twittermoments wishing only the best to everyone affected.. #harveyrelief #houstonstrong #helpforhouston #harveyheroes #houstonfloods
902960968745005057|2017-08-30 13:27:25|Chicago Heights|United States|United States|null|(41.481426,-87.674421),(41.543213,-87.674421),(41.543213,-87.596844),(41.481426,-87.596844),|@billoreilly americans in need from hurricane not one word from democratic leaders nancy pelosi -chuck schumer mayb… https://t.co/m7bemoqobr
902961127008677897|2017-08-30 13:28:03|West Virginia|West Virginia, USA|United States|null|(37.201483,-82.644739),(40.638802,-82.644739),(40.638802,-77.71893),(37.201483,-77.71893),|i applaud everyone that is helping those affected by #hurricaneharvey. it should be people helping others.
902961137855148037|2017-08-30 13:28:06|Canada|Edmonton Alberta|Canada|null|(41.676329,-141.561094),(89.9999,-141.561094),(89.9999,-51.053519),(41.676329,-51.053519),|"#abgov responds to #harvey2017 ""we are preparing options and waiting for fema and the federal government to tell us what is needed.” #cbc"
902961139339931650|2017-08-30 13:28:06|Chicago|Chicago (Albany Park), IL|United States|null|(41.644102,-87.940033),(42.023067,-87.940033),(42.023067,-87.523993),(41.644102,-87.523993),|should president trump accept help, including sheltering the displaced, from mexico? #hurricaneharvey
902961348857999362|2017-08-30 13:28:56|Toronto|Toronto, Canada|Canada|null|(43.403221,-79.639319),(43.855401,-79.639319),(43.855401,-78.90582),(43.403221,-78.90582),|@ap wow.. wishing only the best to everyone affected..  i hope things will improve shortly #harveyrelief #houstonstrong #helpforhouston
902961356244082688|2017-08-30 13:28:58|Los Angeles|Los Angeles|United States|null|(33.704538,-118.668404),(34.337041,-118.668404),(34.337041,-118.155409),(33.704538,-118.155409),|my heart breaks for those fighting harvey, i donated all i could but doubt my twenty bucks is helpful. is there anything else i can do?
902961391920865280|2017-08-30 13:29:06|Los Angeles|Los Angeles, CA|United States|null|(33.704538,-118.668404),(34.337041,-118.668404),(34.337041,-118.155409),(33.704538,-118.155409),|#hurricaineharvey : socialism = volunteers helping to rescue ppl; capitalist  market forces = price gouging.  i know which 1 i prefer.
902961499014082567|2017-08-30 13:29:32|Houston|lynwood california |United States|29.78574528,-95.55186614|(29.522325,-95.823268),(30.154665,-95.823268),(30.154665,-95.069705),(29.522325,-95.069705),|if anyone in the need of a new car after this horrible hurricane… https://t.co/ffbwfzn0ip
902961531289296897|2017-08-30 13:29:39|Texas|Austin, TX|United States|null|(25.837092,-106.645646),(36.500695,-106.645646),(36.500695,-93.508131),(25.837092,-93.508131),|#hurricaneharvey #helphouston https://t.co/j6sctiduqr https://t.co/gowqomdpvs
902961818347417601|2017-08-30 13:30:48|Toronto|Toronto, Canada|Canada|null|(43.403221,-79.639319),(43.855401,-79.639319),(43.855401,-78.90582),(43.403221,-78.90582),|@ap wow.. wishing only the best to everyone affected..  i hope things will improve shortly #harveyrelief #helpforhouston #houstonstrong
902961872005148675|2017-08-30 13:31:01|Groves|Groves, TX|United States|null|(29.924735,-93.944772),(29.96429,-93.944772),(29.96429,-93.890543),(29.924735,-93.890543),|my heart goes out to those effected by harvey! my family and i were so blessed to have not been effected but if you need help hmu!
902961878816739328|2017-08-30 13:31:02|Queens|New York|United States|null|(40.541722,-73.962582),(40.800037,-73.962582),(40.800037,-73.699793),(40.541722,-73.699793),|helping those in need from hurricane harvey @sendrelief @namb_sbc https://t.co/swrzfdxxzs
902961994206203904|2017-08-30 13:31:30|Plano|Dallas, TX|United States|null|(32.997151,-96.85743),(33.125334,-96.85743),(33.125334,-96.612371),(32.997151,-96.612371),|it's interesting that harvey hit hardest where a lot of trump supporters live. question, do they want a wall or help rebuilding their homes?
902962060387991552|2017-08-30 13:31:46|Brigham City|360 W 900 N Apt#207 Brigham,UT|United States|null|(41.482888,-112.044684),(41.535977,-112.044684),(41.535977,-111.968998),(41.482888,-111.968998),|https://t.co/aewo26qvac https://t.co/2juslyzd68 is trying to help out the hurricane harvey needs in huston, texas
902962164725555200|2017-08-30 13:32:10|Georgia|America|United States|null|(30.355644,-85.605166),(35.000771,-85.605166),(35.000771,-80.742567),(30.355644,-80.742567),|@realdonaldtrump you need to be focused on #harvey.  try not to be such a #douchebag next time.
902962194521960451|2017-08-30 13:32:18|Parmley Elementary School|null|United States|null|(30.42761,-95.484281),(30.42761,-95.484281),(30.42761,-95.484281),(30.42761,-95.484281),|me and my crew helping and donating at the willis parent support center. #willis1t1p #hurricaneharveyrelief https://t.co/qf7nokmorb
902962225119453188|2017-08-30 13:32:25|Iowa|Clarion, IA|United States|null|(40.375437,-96.639667),(43.50102,-96.639667),(43.50102,-90.140061),(40.375437,-90.140061),|wright county #businesses like @goservg are helping out with #hurricane #harvey #recovery.  you can help them. https://t.co/gbqfgm0xgv
902962245449199619|2017-08-30 13:32:30|Louisville|Louisville, Kentucky|United States|null|(38.108678,-85.847503),(38.282432,-85.847503),(38.282432,-85.597188),(38.108678,-85.597188),|a group from #louisville is heading to #harveyflood help. https://t.co/rcgjwqtwsk
902962315426967552|2017-08-30 13:32:46|Queens|Far Rockaway Beach, NY 11691|United States|null|(40.541722,-73.962582),(40.800037,-73.962582),(40.800037,-73.699793),(40.541722,-73.699793),|https://t.co/qedqzhhlep #floodvictims of #hurricaneharvey in #stateoftexas needs #help / any #donations you're… https://t.co/zzntagdv2s
902962484163764224|2017-08-30 13:33:27|Los Angeles|null|United States|null|(33.704538,-118.668404),(34.337041,-118.668404),(34.337041,-118.155409),(33.704538,-118.155409),|f off unless you're going to help. slashing budgets for disaster relief programs days before the hurricane. yea. sh… https://t.co/xmiliowd3h
902962502861860864|2017-08-30 13:33:31|Los Angeles|Los Angeles, CA|United States|null|(33.704538,-118.668404),(34.337041,-118.668404),(34.337041,-118.155409),(33.704538,-118.155409),|sell your shoe collection and donate proceeds to rebuilding homes. #nuffsaid #harveyhelp https://t.co/gbbwwhhp8x
902962539738402816|2017-08-30 13:33:40|Houston|3905 NW 31st Ave. Miami, FL |United States|null|(29.522325,-95.823268),(30.154665,-95.823268),(30.154665,-95.069705),(29.522325,-95.069705),|floridians know the devastating effects of hurricanes firsthand. #prayfortexas and help those most affected… https://t.co/r769m0ldhz
902962543462948864|2017-08-30 13:33:41|Robinson|null|United States|null|(31.448051,-97.1445),(31.507322,-97.1445),(31.507322,-97.095627),(31.448051,-97.095627),|i know i don't need it but ima gonna make what those yankee hurricane news reporters would call a pee-can pie
902962610651332608|2017-08-30 13:33:57|El Paso|El Paso, TX|United States|null|(31.620668,-106.634874),(31.966068,-106.634874),(31.966068,-106.199987),(31.620668,-106.199987),|"@cnn leave the hurricane victims alone to get help and some peace, fr. media goes to any extent just to get a ""good story"". it's sickening."
902962785696526353|2017-08-30 13:34:39|Houston|Houston|United States|null|(29.522325,-95.823268),(30.154665,-95.823268),(30.154665,-95.069705),(29.522325,-95.069705),|@ingridnilsen one of the most needed things for #hurricaneharvey relief is period products! do you know anyone i can contact for donations?
902962827325038592|2017-08-30 13:34:48|Nashville|null|United States|null|(35.994568,-87.022482),(36.405448,-87.022482),(36.405448,-86.560616),(35.994568,-86.560616),|fake pres:trump is going 2 need more money than just for texas b/c harvey is not through yet media reporters @msnbc & @cnn.
902962832366383104|2017-08-30 13:34:50|Los Angeles|Los Angeles, CA|United States|null|(33.704538,-118.668404),(34.337041,-118.668404),(34.337041,-118.155409),(33.704538,-118.155409),|amen erica. and if it's not a house of worship, it shouldn't get tax breaks. simple solution. #harveyhelp https://t.co/y7z2wzglkg
902963069785169920|2017-08-30 13:35:46|Lubbock|Lubbock, TX|United States|null|(33.44712,-102.033765),(33.693933,-102.033765),(33.693933,-101.760581),(33.44712,-101.760581),|"""cops are so selfish and racist."" *cops across texas leave their homes and families to help hurricane victims*  🤔"
902963092857991176|2017-08-30 13:35:52|Kansas City|Kansas City|United States|null|(38.868002,-94.733122),(39.332095,-94.733122),(39.332095,-94.385441),(38.868002,-94.385441),|afl-cio: a way to help working people affected by hurricane harvey. please donate now to:  texas workers relief fund https://t.co/oxxyxgbbtp
902963170938990594|2017-08-30 13:36:10|Chino Valley|Arizona, USA|United States|null|(34.720203,-112.518954),(34.805277,-112.518954),(34.805277,-112.424967),(34.720203,-112.424967),|i joined the national guard to be of help in situations like houston and the hurricane. i'm glad i'm out but i wish i could be helping.
902963196134395905|2017-08-30 13:36:16|Manhattan|New York, NY|United States|null|(40.683935,-74.026675),(40.877483,-74.026675),(40.877483,-73.910408),(40.683935,-73.910408),|everyone come out tomorrow night to the public hotel to help raise money for the hurricane harvey relief fund! https://t.co/af2dekzifr
902963300417318916|2017-08-30 13:36:41|Queens|Far Rockaway Beach, NY 11691|United States|null|(40.541722,-73.962582),(40.800037,-73.962582),(40.800037,-73.699793),(40.541722,-73.699793),|https://t.co/qedqzhhlep #floodvictims of #hurricaneharvey in #stateoftexas needs #help / any #donations you're… https://t.co/c4y54txwna
902963309246382080|2017-08-30 13:36:43|Corpus Christi|281 to my city. |United States|null|(27.578509,-97.662618),(27.895793,-97.662618),(27.895793,-97.202232),(27.578509,-97.202232),|‼️‼️ anyone know someone in this area with a boat?? they need help. family, dogs, and cats. #harvey #flooding… https://t.co/u43rxjugdu
902963369715609602|2017-08-30 13:36:58|Springdale|null|United States|null|(36.133324,-94.223887),(36.23998,-94.223887),(36.23998,-94.083891),(36.133324,-94.083891),|click the link below to donate to convoy of hope and help those affected by #hurricaneharvey.… https://t.co/7yambjpclr
902963397444165632|2017-08-30 13:37:04|Port Arthur|Dallas, TX|United States|null|(29.823923,-94.053284),(29.979166,-94.053284),(29.979166,-93.858553),(29.823923,-93.858553),|1) to everyone feeling helpless about the #texasflood - you can watch twitter or facebook and direct new posts to use #harveysos  # <city>
902963420504436738|2017-08-30 13:37:10|Michigan|Michigan, USA|United States|null|(41.696088,-90.418108),(48.306272,-90.418108),(48.306272,-82.122971),(41.696088,-82.122971),|"these good for nothing pos are not what america is.. your stupid ""protesting"" doesn't help hurricane victims!! https://t.co/mnuiogja9g"
902963489404108800|2017-08-30 13:37:26|Denver|Denver, Colorado|United States|null|(39.614151,-105.109815),(39.812975,-105.109815),(39.812975,-104.734372),(39.614151,-104.734372),|as the daughter of ministers, @joelosteen makes me ill.  let me wait for someone to ask me first b4 i help- said no man of god ever. #harvey
902963566717882368|2017-08-30 13:37:45|Flushing|Flint, MI|United States|null|(43.030075,-83.881973),(43.13338,-83.881973),(43.13338,-83.812721),(43.030075,-83.812721),|you can help little miss flint aid those affected by harvey here: https://t.co/lpz1cans6m
902963568815026185|2017-08-30 13:37:45|Nashville|Nashville, Tennessee|United States|null|(35.994568,-87.022482),(36.405448,-87.022482),(36.405448,-86.560616),(35.994568,-86.560616),|here is how you can help the people in houston! #hurricaneharvey https://t.co/7lfavniq4v
902963628432863238|2017-08-30 13:37:59|Houston|ÜT: 29.541192,-95.042676|United States|null|(29.522325,-95.823268),(30.154665,-95.823268),(30.154665,-95.069705),(29.522325,-95.069705),|we survived harvey! we are open and here to help! #agwesthouston #hurricaneharvey #houstonstrong #texastough… https://t.co/rvfumqbda2
902963658015297536|2017-08-30 13:38:06|Toronto|Toronto|Canada|null|(43.403221,-79.639319),(43.855401,-79.639319),(43.855401,-78.90582),(43.403221,-78.90582),|marketers unite - donate to help #harveyrelief https://t.co/gtb5n3fo5p
902963675744665600|2017-08-30 13:38:11|Binghamton|Upstate NY|United States|null|(42.067082,-75.95015),(42.156489,-75.95015),(42.156489,-75.857034),(42.067082,-75.857034),|ughhhhh the wall won't help texas recover from harvey & the wall won't help with the next natural disaster. wake up! https://t.co/cglnmj0dr4
902963699752849409|2017-08-30 13:38:16|Brooklyn|Brooklyn, NY|United States|null|(40.570842,-74.041878),(40.739434,-74.041878),(40.739434,-73.855673),(40.570842,-73.855673),|having to donate to hurricane relief is equivalent to gofundme asks for hospital bills. the federal gov't has the funds to help, but refuses
902963777196437504|2017-08-30 13:38:35|Fellowship Church|2450 N Hwy 121 Grapevine 76051|United States|null|(32.963415,-97.0339),(32.963415,-97.0339),(32.963415,-97.0339),(32.963415,-97.0339),|help us fill a semi-truck with supplies for those impacted by the hurricane! #pressplay https://t.co/e3nhjtg8u8
902963822524325889|2017-08-30 13:38:46|Port Arthur|Dallas, TX|United States|null|(29.823923,-94.053284),(29.979166,-94.053284),(29.979166,-93.858553),(29.823923,-93.858553),|2) to anyone willing to help https://t.co/dubpjhudeu & @harveyrescue collect names of people so no one is left behind. can you copy/paste?
902963844355633162|2017-08-30 13:38:51|Houston|San Marcos|United States|29.7629,-95.3832|(29.522325,-95.823268),(30.154665,-95.823268),(30.154665,-95.069705),(29.522325,-95.069705),|please share! we need 75-100 people!! #harvey #hurricaneharvey #houstonstrong #houstinfloods… https://t.co/84td8ykpip
902963968561557515|2017-08-30 13:39:21|Knoxville|Alcoa, Tenn.|United States|null|(35.831436,-84.19397),(36.133505,-84.19397),(36.133505,-83.733713),(35.831436,-83.733713),|need bulletin insert to explain our holston #umc reponse to #harvey? here ya go https://t.co/ehg7r4gb5n https://t.co/j7ebnrqvqk
902964098513719296|2017-08-30 13:39:52|Silver Spring|Washington, DC|United States|null|(38.979735,-77.064086),(39.036964,-77.064086),(39.036964,-76.97162),(38.979735,-76.97162),|continued prayers for those harmed by #harvey. inspiring to see americans coming together to help & encourage suppo… https://t.co/lnyim7fect
902964108009623552|2017-08-30 13:39:54|Philadelphia|New York, NY, USA|United States|null|(39.871811,-75.280284),(40.13792,-75.280284),(40.13792,-74.955712),(39.871811,-74.955712),|it's #stupid that #trump's henchmen need to come up with the empathy he lacks for #hurricaineharvey victims.  #sad! https://t.co/yubxkotggn
902964210761641984|2017-08-30 13:40:18|Chicago|Chicago|United States|null|(41.644102,-87.940033),(42.023067,-87.940033),(42.023067,-87.523993),(41.644102,-87.523993),|#cleanyourcloset4harvey please share: time 2 purge the stuff holding you back give 2 others in need #makeamericagreatagain! #alllivesmatter!
902964268248600576|2017-08-30 13:40:32|Albuquerque|Albuquerque, NM|United States|null|(35.015891,-106.791691),(35.218114,-106.791691),(35.218114,-106.473745),(35.015891,-106.473745),|las cruces comes together to help hurricane harvey victims https://t.co/jdjh7xbocx
902964297973751809|2017-08-30 13:40:39|Hawaii|Kirkland, WA|United States|null|(18.86546,-178.443593),(28.517269,-178.443593),(28.517269,-154.755792),(18.86546,-154.755792),|between #houston & #portarthur we need everyone to pitch in. give what you can. do what you can. #harvey https://t.co/1jxgxel2yb
902964311525433344|2017-08-30 13:40:42|Los Angeles|Los Angeles, CA|United States|null|(33.704538,-118.668404),(34.337041,-118.668404),(34.337041,-118.155409),(33.704538,-118.155409),|#hurricaneharvey : socialism = volunteers helping to rescue ppl; capitalist  market forces = price gouging.  i know which 1 i prefer.
902964406010740738|2017-08-30 13:41:05|Florida|null|United States|27.01137361,-80.45955411|(24.396308,-87.634643),(31.001056,-87.634643),(31.001056,-79.974307),(24.396308,-79.974307),|"hurricane harvey relief | how you can help - move for hunger : move for hunger"
902964484754612224|2017-08-30 13:41:24|Washington|Washington D.C.|United States|null|(38.801826,-77.119401),(38.99538,-77.119401),(38.99538,-76.909396),(38.801826,-76.909396),|3 orgs you can give to right now to help those affected by #hurricaneharvey. all doing great work on the ground in… https://t.co/tcxgahu0ue
902965152856682496|2017-08-30 13:44:03|Albuquerque|Albuquerque, NM|United States|null|(35.015891,-106.791691),(35.218114,-106.791691),(35.218114,-106.473745),(35.015891,-106.473745),|lord please help all those affected by hurricane harvey, we all need to love each other america.
902965281676513280|2017-08-30 13:44:34|Dallas|Dallas, TX|United States|null|(32.620678,-96.977527),(33.019039,-96.977527),(33.019039,-96.54598),(32.620678,-96.54598),|today, he's helping direct our @dallasnewsphoto team all over #texas in #harvey's aftermath. #txwx https://t.co/giqasy230m
902965289662472192|2017-08-30 13:44:35|Frisco|Frisco, TX|United States|null|(33.081206,-96.937783),(33.219073,-96.937783),(33.219073,-96.732715),(33.081206,-96.732715),|special announcement! bring a case of water to help our friends in houston on any poker night this week & receive 10k in chips! #harvey2017
902965295001821185|2017-08-30 13:44:37|Weatherford|Hogwarts|United States|null|(35.517222,-98.725251),(35.558904,-98.725251),(35.558904,-98.626215),(35.517222,-98.626215),|my heart is beaming w/ happiness seeing that swosu is helping houston. #harveyheroes 💙   please donate things to @jacob_salmon!
902965296872468484|2017-08-30 13:44:37|Houston|null|United States|null|(29.522325,-95.823268),(30.154665,-95.823268),(30.154665,-95.069705),(29.522325,-95.069705),|teachers need your help from #hurricaneharvey https://t.co/pbfzaxxnj7
902965387687469056|2017-08-30 13:44:59|San Francisco|San Francisco|United States|null|(37.708075,-122.514926),(37.833238,-122.514926),(37.833238,-122.357031),(37.708075,-122.357031),|#hurricaineharvey continues flooding the region--here are more ways to help those in need. https://t.co/hcuorb4rij
902965456318889984|2017-08-30 13:45:15|La Porte|null|United States|null|(29.601579,-95.113868),(29.730034,-95.113868),(29.730034,-95.000382),(29.601579,-95.000382),|shoutout to @boostmobile & @metropcs for waving the fees of people affected by harvey. @tmobile @tmobilehelp still makes you pay whole bill!
902965568931717120|2017-08-30 13:45:42|Palmdale|Antelope Valley, CA|United States|null|(34.521165,-118.262388),(34.646093,-118.262388),(34.646093,-117.988004),(34.521165,-117.988004),|#rt #donate #help #hurricaneharvey #redcross https://t.co/ucekrfubj3
902965632789913600|2017-08-30 13:45:57|San Diego|San Diego, CA|United States|null|(32.53962,-117.282538),(33.080404,-117.282538),(33.080404,-116.92744),(32.53962,-116.92744),|so devastating to see what's going on! if you can help out with #hurricaneharvy please do get all of the details be… https://t.co/mmox9spekq
902965846359908352|2017-08-30 13:46:48|Pennsylvania|Julian, Pennsylvania|United States|null|(39.719801,-80.519851),(42.516072,-80.519851),(42.516072,-74.689517),(39.719801,-74.689517),|#hurricaneharvey #helpthepoor #helpstopthestruggle #helpfixhomes #helpdisabledppl #helptheanimals #helpthyneighbor donate &/or volunteer
902965876449783809|2017-08-30 13:46:55|Bailey's Crossroads|Virginia, USA|United States|null|(38.832027,-77.147585),(38.861746,-77.147585),(38.861746,-77.110316),(38.832027,-77.110316),|45* is reading again...teleprompter empathy at its best! #trumpinmissouri #harvey  #helpforharvey https://t.co/evyim4bppc
902965929679704068|2017-08-30 13:47:08|Red Dog Leader's Command Post|THE POCONO MOUNTAINS|United States|null|(40.997083,-75.183671),(40.997083,-75.183671),(40.997083,-75.183671),(40.997083,-75.183671),|how to help victims of hurricane harvey https://t.co/i2hgvgtgzh
902966033434148865|2017-08-30 13:47:33|Baltimore|Litchfield Park, Az|United States|null|(39.197211,-76.711521),(39.372215,-76.711521),(39.372215,-76.529443),(39.197211,-76.529443),|@kfdmnews my family members in port arthur tx (2600 thomas blvd) need help water rising #harvey #harveyrelief #harveyflood #portarthur
902966182344482816|2017-08-30 13:48:08|Littleton|Rocky Mountains  ❄Born Aug 15|United States|null|(39.563868,-105.062023),(39.62983,-105.062023),(39.62983,-104.973551),(39.563868,-104.973551),|if you are on fema deployment or any other agency helping out in tx & la, please carry dog & cat food in your cars. #harveyrelief 😿🐶 ty! 😻
902966179446366208|2017-08-30 13:48:08|Indiana|Valparaiso, Indiana|United States|null|(37.771743,-88.097892),(41.761368,-88.097892),(41.761368,-84.78458),(37.771743,-84.78458),|working alongside this church to help victims of harvey. please help. every gift makes a difference https://t.co/jwyz9ziv7v
902966239387103232|2017-08-30 13:48:22|Goodyear|Goodyear, AZ|United States|null|(33.317555,-112.508916),(33.50819,-112.508916),(33.50819,-112.341035),(33.317555,-112.341035),|if you are looking for a #hurricaneharvey donation site: https://t.co/acsdbmeilw #helphouston #neighborshelpingneighbors #hopeforhouston
902966246861410305|2017-08-30 13:48:24|Reston|Reston, Va.|United States|null|(38.90861,-77.393246),(39.002993,-77.393246),(39.002993,-77.304868),(38.90861,-77.304868),|.@restonrotary plans fundraiser tonight at café montmartre to benefit aid for #hurricaneharvey victims… https://t.co/stomtcpyzh
902966250904702976|2017-08-30 13:48:25|Queens|Far Rockaway Beach, NY 11691|United States|null|(40.541722,-73.962582),(40.800037,-73.962582),(40.800037,-73.699793),(40.541722,-73.699793),|https://t.co/6thkj2ygoe #floodvictims of #hurricaneharvey in #stateoftexas needs #help / any #donations you're #able to #give are #welcome🌊
902966261868572672|2017-08-30 13:48:27|Agawam|Melrose Park IL|United States|null|(42.03108,-72.710598),(42.102783,-72.710598),(42.102783,-72.584948),(42.03108,-72.584948),|trump insists he’ll build a border wall. mexico says they won't pay for it — and offers hurricane harvey aid instead #lovealwayswins
902966349323960320|2017-08-30 13:48:48|Florida|International|United States|null|(24.396308,-87.634643),(31.001056,-87.634643),(31.001056,-79.974307),(24.396308,-79.974307),|iaapa stands with those impacted by hurricane harvey and typhoon hato. here's how to help or how to contact us:… https://t.co/edq88vfijs
902966392869322753|2017-08-30 13:48:59|Louisiana|Lil Weezyana|United States|null|(28.855128,-94.043628),(33.019544,-94.043628),(33.019544,-88.758389),(28.855128,-88.758389),|what places/shelters in texas that needs volunteers? i'll be taking a two day trip next week #harveysos #hurricaneharvey
902966480341315584|2017-08-30 13:49:19|Los Angeles|null|United States|null|(33.704538,-118.668404),(34.337041,-118.668404),(34.337041,-118.155409),(33.704538,-118.155409),|#urgent: harvey death toll now 24
902966538667511809|2017-08-30 13:49:33|Hattiesburg|Galveston.Houston.Hattiesburg|United States|null|(31.241189,-89.427669),(31.380085,-89.427669),(31.380085,-89.248409),(31.241189,-89.248409),|#houston might be in the clear now but we need to take care of our neighbors in beaumont, la, and now mississippi. #southernstrong #harvey
902966615041601537|2017-08-30 13:49:51|North Richland Hills|North Richland Hills, TX|United States|null|(32.808748,-97.264529),(32.912026,-97.264529),(32.912026,-97.184107),(32.808748,-97.184107),|we are #houstonstrong! to help those affected by hurricane harvey, please text harvey to 90999 to donate $10 to the… https://t.co/gjt0bktf7n
902966775121313792|2017-08-30 13:50:30|Fort Lauderdale|Delray Beach, Fla|United States|null|(26.080935,-80.20811),(26.219801,-80.20811),(26.219801,-80.090235),(26.080935,-80.090235),|helping hands for hurricane victims @lynoraskitchen https://t.co/xnw6hut7ck #myspikeytavel #texasstrong… https://t.co/wjukl6vsgy
902966779911266305|2017-08-30 13:50:31|Round Rock|Austin, TX|United States|null|(30.468442,-97.755394),(30.570239,-97.755394),(30.570239,-97.59007),(30.468442,-97.59007),|in '05 i donated a drumset to a school in need after katrina let's do the same for #hurricaneharvey who knows a need?
902966797216890881|2017-08-30 13:50:35|Troy|WonderLand, 420 Alchemists Way|United States|null|(38.95424,-91.023373),(39.00331,-91.023373),(39.00331,-90.948508),(38.95424,-90.948508),|@joelosteen  #hurricaneharvey  #helpforhouston https://t.co/tkgrbldjje
902966839780790274|2017-08-30 13:50:45|Warwick|Lancaster, TX|United States|41.7181,-71.4152|(41.629501,-71.518925),(41.76838,-71.518925),(41.76838,-71.354415),(41.629501,-71.354415),|join us through @sacornerstone in giving to help the hurricane harvey relief efforts. thanks and… https://t.co/jnparmopif
