tweet_id|datetime|city|state|country|gps|polygon|tweet
902904610456817665|2017-08-30 09:43:28|Houston|space|United States|null|(29.522325,-95.823268),(30.154665,-95.823268),(30.154665,-95.069705),(29.522325,-95.069705),|trying to find out what people need. the info is not forthcoming. going to keep trying to figure it out. #harvey
902904618765742080|2017-08-30 09:43:30|Fair Lawn|NJNJ|United States|null|(40.917486,-74.148182),(40.955019,-74.148182),(40.955019,-74.089421),(40.917486,-74.089421),|#suits100 harvey needs to close mike sorrynotsorry
902904638713860097|2017-08-30 09:43:35|Austin|null|United States|null|(30.127892,-97.928935),(30.518799,-97.928935),(30.518799,-97.580513),(30.127892,-97.580513),|@airbnbhelp   i just signed up to offer rooms in our home as needed for hurricane harvey evacuees.  what is the next step?
902904638898401282|2017-08-30 09:43:35|Dallas|Dallas/Cali|United States|null|(32.620678,-96.977527),(33.019039,-96.977527),(33.019039,-96.54598),(32.620678,-96.54598),|who need help inn#htown #huricaneharvey
902904664382988289|2017-08-30 09:43:41|Rahway|Freehold, NJ|United States|null|(40.592141,-74.305281),(40.627526,-74.305281),(40.627526,-74.255435),(40.592141,-74.255435),|2 hurricane harvey organizations that need contributions: food bank: https://t.co/hwa81nxxxq  hh relief fund: https://t.co/5njemhnoaz
902904687921389568|2017-08-30 09:43:47|Denver|nyc. la. san diego. london|United States|null|(39.614151,-105.109815),(39.812975,-105.109815),(39.812975,-104.734372),(39.614151,-104.734372),|our thoughts are with everyone affected by #hurricaneharvey. here's how you can help, wherever you are: https://t.co/h9wj66xyat
902904694577790976|2017-08-30 09:43:49|Chester|Hollywood, CA|United States|null|(39.822204,-75.40809),(39.875846,-75.40809),(39.875846,-75.343739),(39.822204,-75.343739),|i'm going to texas! myself and a few other will be going to help aid in the hurricane harvey relief efforts. #chestertohouston
902904718279806976|2017-08-30 09:43:54|Nashville|Nashville, TN|United States|null|(35.994568,-87.022482),(36.405448,-87.022482),(36.405448,-86.560616),(35.994568,-86.560616),|if you're a lyft user, you now have the option to round up and donate to the red cross to help those affected by hurricane harvey.
902904798789255171|2017-08-30 09:44:13|Los Angeles|Los angeles|United States|null|(33.704538,-118.668404),(34.337041,-118.668404),(34.337041,-118.155409),(33.704538,-118.155409),|watching home town flood.needed i-10 to get anywhere. listening for how to best help moving forward. #harvey https://t.co/as3afvcssp
902904849922183168|2017-08-30 09:44:26|South Carolina|null|United States|null|(32.04683,-83.353955),(35.215449,-83.353955),(35.215449,-78.499301),(32.04683,-78.499301),|seth rollins helping with harvey relief #wwe #sethrollins #hurricaneharveyrelief https://t.co/ntzavenfh8
902904899771486208|2017-08-30 09:44:37|Winston|Lakeland, FL|United States|null|(28.025279,-82.056058),(28.070536,-82.056058),(28.070536,-81.98187),(28.025279,-81.98187),|proud to work for a trusted company that is dedicated to assisting those in need. publix donated $250k to the areas affected by harvey. 💚
902904933984415744|2017-08-30 09:44:46|Queens|earth|United States|null|(40.541722,-73.962582),(40.800037,-73.962582),(40.800037,-73.699793),(40.541722,-73.699793),|to understand harvey's scale, you need a perspective from space  https://t.co/n7bq7ex274 they will get worse
902904974291726336|2017-08-30 09:44:55|Atlanta|Atlanta, GA, USA|United States|null|(33.647503,-84.576827),(33.886886,-84.576827),(33.886886,-84.289385),(33.647503,-84.289385),|hurricane harvey reinforces need for cities to plan for disaster resiliency https://t.co/icbxvxfb7s @snarkitectdc
902904980155371522|2017-08-30 09:44:57|Minneapolis|Minneapolis, MN|United States|null|(44.889964,-93.329515),(45.051257,-93.329515),(45.051257,-93.194578),(44.889964,-93.194578),|here are the ways minnesotans can help the dogs of #hurricaneharvey (no road trip required): https://t.co/rbufqmpcbk https://t.co/c3jmjzybtp
902905004901597184|2017-08-30 09:45:02|Albany|Boston / Berkeley|United States|null|(37.881262,-122.327841),(37.899029,-122.327841),(37.899029,-122.281664),(37.881262,-122.281664),|how is there not a “i need to be rescued” harvey hashtag? i suggest #harveyrescue. should also try to standardize formatting.
902905079216439296|2017-08-30 09:45:20|Washington|Washington, DC|United States|null|(38.801826,-77.119401),(38.99538,-77.119401),(38.99538,-76.909396),(38.801826,-76.909396),|.@fema has already provided $35 million in aid to nearly 200,000 disaster victims https://t.co/ns3fg40zuv #hurricaneharvey2017
902905138414624768|2017-08-30 09:45:34|Atascocita|USA|United States|29.92486881,-95.20309247|(29.912242,-95.249792),(30.033094,-95.249792),(30.033094,-95.135568),(29.912242,-95.135568),|you want to help? milk and bread is a great start! call kroger!  #huricaneharvey #prayforhouston… https://t.co/ityghub6xc
902905295588003840|2017-08-30 09:46:12|Tampa|null|United States|null|(27.821353,-82.620093),(28.171836,-82.620093),(28.171836,-82.265295),(27.821353,-82.265295),|@kendraax2 #harveysos #harveyform #harveydreamteam #harveydrop get to the roof if possible. help will be there. sta… https://t.co/neygrbgehm
902905544696090624|2017-08-30 09:47:11|Manhattan|New York City|United States|40.7142,-74.0064|(40.683935,-74.026675),(40.877483,-74.026675),(40.877483,-73.910408),(40.683935,-73.910408),|❤️🙏🏻 we can all help the people affected by hurricane harvey. please donate, any little bit… https://t.co/wnasq65ayv
902905713181171712|2017-08-30 09:47:51|Hayward|null|United States|null|(37.592632,-122.160814),(37.689909,-122.160814),(37.689909,-122.010737),(37.592632,-122.010737),|congress: i demand #ajustharveyrecovery https://t.co/31mj6nb5yw
902905763525525504|2017-08-30 09:48:03|Austin|Austin, TX|United States|null|(30.127892,-97.928935),(30.518799,-97.928935),(30.518799,-97.580513),(30.127892,-97.580513),|y'all probably know about @austinpetsalive, but we're reminding you anyway. help those displaced pets! #harveyrelief https://t.co/pis2uiokgq
902905913153130496|2017-08-30 09:48:39|Dallas|The Valley|United States|null|(32.620678,-96.977527),(33.019039,-96.977527),(33.019039,-96.54598),(32.620678,-96.54598),|another way to help! #hurricaneharveyrelief https://t.co/c5unhmx7ll
902906002785398784|2017-08-30 09:49:00|Michigan|Michigan, USA|United States|null|(41.696088,-90.418108),(48.306272,-90.418108),(48.306272,-82.122971),(41.696088,-82.122971),|make sure to send your prayers to hurricane harvey's victims and the thousands of people needing rescue
902906007877148672|2017-08-30 09:49:02|Los Angeles|null|United States|null|(33.704538,-118.668404),(34.337041,-118.668404),(34.337041,-118.155409),(33.704538,-118.155409),|here’s how to get help if you've been displaced by harvey.   https://t.co/zqhpgrckmt
902906283468214272|2017-08-30 09:50:07|Naperville|Naperville, IL|United States|null|(41.665584,-88.259598),(41.831408,-88.259598),(41.831408,-88.063045),(41.665584,-88.063045),|woe is me! 😭i'm much more important than any hurricane victim. i don't need to respect people! people need to respe… https://t.co/lwsxhgutex
902906311918145536|2017-08-30 09:50:14|Murfreesboro|Murfreesboro, TN|United States|null|(35.751433,-86.505805),(35.943407,-86.505805),(35.943407,-86.313415),(35.751433,-86.313415),|way to go #murfreesboro thanks for helping out #hurricaneharvey https://t.co/shqhh4qehq
902906420970102784|2017-08-30 09:50:40|Minneapolis|null|United States|null|(44.889964,-93.329515),(45.051257,-93.329515),(45.051257,-93.194578),(44.889964,-93.194578),|@mimileeevans @q13fox praise thelord: now ppl need2 remember that business & patronize royally; givn back2those who didn't hesitate #harvey
902906471893143552|2017-08-30 09:50:52|Wallington|Wallington, NJ|United States|null|(40.841495,-74.121151),(40.863791,-74.121151),(40.863791,-74.096269),(40.841495,-74.096269),|@sony @panasonic @johndeere @the_tetley @tetleyuk @officemax @_officepro_  @zulily @budweiser @coorslight help hurricane harvey victims
902906473855975424|2017-08-30 09:50:53|Jackson|Jackson, TN|United States|null|(35.533842,-88.927948),(35.754808,-88.927948),(35.754808,-88.749242),(35.533842,-88.749242),|texas needs our help after #hurricaneharvey. text the word harvey to 90999 to make a $10 donation to @redcross https://t.co/f8dxz8trf5
902906588750503937|2017-08-30 09:51:20|San Clemente|Orange County, Ca.|United States|null|(33.386645,-117.666227),(33.490825,-117.666227),(33.490825,-117.571015),(33.386645,-117.571015),|anyone know how much the trumps have donated to relief efforts?? #helpforhouston #harveyflood #houstonflood #hurricaineharvey
902906628500058113|2017-08-30 09:51:30|Illinois|United States|United States|null|(36.970298,-91.51308),(42.508303,-91.51308),(42.508303,-87.019935),(36.970298,-87.019935),|@walshfreedom americans in need from hurricane not one word from democrat leaders nancy pelosi - chuck schemer mayb… https://t.co/hvrvnoltca
902906812235628545|2017-08-30 09:52:13|Santa Clara|San Francisco, CA|United States|null|(37.322943,-122.005597),(37.419037,-122.005597),(37.419037,-121.930045),(37.322943,-121.930045),|@bmcsoftware @redcross to help those affected by #hurricaneharvey, visit https://t.co/vbekzkfywl, call 800-red cros… https://t.co/fscksxp4r9
902906812235628545|2017-08-30 09:52:13|Santa Clara|San Francisco, CA|United States|null|(37.322943,-122.005597),(37.419037,-122.005597),(37.419037,-121.930045),(37.322943,-121.930045),|@bmcsoftware @redcross to help those affected by #hurricaneharvey, visit https://t.co/vbekzkfywl, call 800-red cros… https://t.co/fscksxp4r9
902906875905273856|2017-08-30 09:52:29|Galveston|Galveston, Texas|United States|null|(29.239602,-94.880809),(29.335548,-94.880809),(29.335548,-94.764742),(29.239602,-94.764742),|law offices of susan m. edmonson are open and ready to help all our clients and neighbors! #hurricaneharvey
902906948970012672|2017-08-30 09:52:46|West Palm Beach|West Palm Beach, FL|United States|null|(26.644671,-80.2006),(26.799121,-80.2006),(26.799121,-80.044639),(26.644671,-80.044639),|the images of animals stranded in the #harveyflood are devastating. local org. are jumping in to help! https://t.co/7qa18g0qvz
902906952707170306|2017-08-30 09:52:47|The Hammocks|null|United States|null|(25.65479,-80.498527),(25.688692,-80.498527),(25.688692,-80.415878),(25.65479,-80.415878),|when a hurricane hits the @miamihurricanes help 👍 https://t.co/ieytuaxtto
902906978132996097|2017-08-30 09:52:53|Arlington|WI - FL - DC / Arlington, VA|United States|null|(38.827378,-77.172219),(38.934311,-77.172219),(38.934311,-77.031779),(38.827378,-77.031779),|#hurricaineharvey if i remember correctly the #trump sons have strong arms & legs where are they? could be helping!… https://t.co/vezj8sbd3v
902907130994458624|2017-08-30 09:53:29|Fort Myers|Cape Coral, FL|United States|null|(26.564625,-81.895498),(26.679673,-81.895498),(26.679673,-81.750855),(26.564625,-81.750855),|lot of displaced pets are going to need fostering from the hurricane  something to think about ...do you have room for one more ..
902907157129170944|2017-08-30 09:53:36|Carteret|"NJ | NY "|United States|null|(40.559086,-74.254762),(40.603565,-74.254762),(40.603565,-74.206263),(40.559086,-74.206263),|love this! .... people are headed into #houston with their boats to help with rescue efforts 💕🙏🏽 #hurricaneharvy https://t.co/ht7xjmgnmu
902907251383451650|2017-08-30 09:53:58|Los Angeles|Los Angeles, CA|United States|null|(33.704538,-118.668404),(34.337041,-118.668404),(34.337041,-118.155409),(33.704538,-118.155409),|@realdonaldtrump really?  a 'campaign-i-need-to-be-adored-speech' when harvey is still reeking havoc and korea is p… https://t.co/fa74bdxhwy
902907258140590081|2017-08-30 09:54:00|Chicago|Northbrook, IL|United States|null|(41.644102,-87.940033),(42.023067,-87.940033),(42.023067,-87.523993),(41.644102,-87.523993),|care cards are needed following #hurricaneharvey2017. visit https://t.co/shd3wwexq3 for more information about care cards. #harveyrelief
902907342009778179|2017-08-30 09:54:20|Cypress|Orange County, CA|United States|null|(33.791963,-118.063298),(33.845856,-118.063298),(33.845856,-118.010668),(33.791963,-118.010668),|charities & orgs helping keep immigrant, black, latinx & other groups safe after harvey https://t.co/9vw50coudg @colorlines #helpforhouston
902907525921730561|2017-08-30 09:55:04|Washington|Washington, DC Metro|United States|null|(38.801826,-77.119401),(38.99538,-77.119401),(38.99538,-76.909396),(38.801826,-76.909396),|i'll be posting a blog about hurricane harvey shortly, specifically about how ehrs have helped patients and physicians #hurricaneharvey
902907629827231745|2017-08-30 09:55:28|Houston|Houston, TX|United States|null|(29.522325,-95.823268),(30.154665,-95.823268),(30.154665,-95.069705),(29.522325,-95.069705),|if you want to help out houston, tx text harvey to #90999 to donate $10 to the @redcross texas relief fund!! i donated and i'm in houston 🙏🏼
902907680787968002|2017-08-30 09:55:40|Austin|Austin, TX|United States|null|(30.127892,-97.928935),(30.518799,-97.928935),(30.518799,-97.580513),(30.127892,-97.580513),|here's how you can help communities of color in houston with #harveyrelief: https://t.co/x16zudbgh7
902907708323622912|2017-08-30 09:55:47|Chicago|Chicago, IL|United States|null|(41.644102,-87.940033),(42.023067,-87.940033),(42.023067,-87.523993),(41.644102,-87.523993),|from my friend @farranweezy 🚨update: my family still needs to be rescued. 4318 kylewood ct., port arthur, tx 77642.  #hurricaneharvey
902907747137601540|2017-08-30 09:55:56|Arvin|null|United States|null|(35.18714,-118.860132),(35.230936,-118.860132),(35.230936,-118.805953),(35.18714,-118.805953),|my carmax is gonna help the carmax out in texas that has been affected by harvey, teamwork 💪🏼
902907974317957122|2017-08-30 09:56:50|Manchester|Boston/New Hampshire • WMUR |United States|null|(42.890919,-71.512722),(43.051479,-71.512722),(43.051479,-71.375439),(42.890919,-71.375439),|update: we are nearing 90-thousand dollars! keep it going! call 603-641-9009 to help victims of hurricane harvey!… https://t.co/km0pfigfki
902908017095651330|2017-08-30 09:57:01|Houston|Houston, TX|United States|null|(29.522325,-95.823268),(30.154665,-95.823268),(30.154665,-95.069705),(29.522325,-95.069705),|if you want to donate and help the kids in houston,tx text hurricane to #20222 to donate $25 to help the kids!! i donated #prayersforhouston
902908078210785284|2017-08-30 09:57:15|San Clemente|San Clemente, Ca.|United States|null|(33.386645,-117.666227),(33.490825,-117.666227),(33.490825,-117.571015),(33.386645,-117.571015),|every little bit helps-red cross &  @scrapyarddawgs hoping 4 ur support 4 victims of hurricane harvey text harvey t… https://t.co/2la3ujdtrn
902908081696366593|2017-08-30 09:57:16|New York|NYC|United States|null|(40.495865,-74.255641),(40.91533,-74.255641),(40.91533,-73.699793),(40.495865,-73.699793),|i just donated. @bakerripley will be helping #harvey victims long after the news cycle moves on. if you have the me… https://t.co/aqo8hhkfxc
902908140026507266|2017-08-30 09:57:30|Austin|Austin, TX|United States|null|(30.127892,-97.928935),(30.518799,-97.928935),(30.518799,-97.580513),(30.127892,-97.580513),|need to buy some gifts? local austin designers contributing proceeds to #harveyrelief: https://t.co/nrkbxjjan3
902908209660182528|2017-08-30 09:57:47|Tiburon|San Francisco/Houston|United States|null|(37.872039,-122.507602),(37.920667,-122.507602),(37.920667,-122.443277),(37.872039,-122.443277),|#hurricaneharvey’s impact on #lng #naturalgas: demand destruction outweighs supply disruptions.  https://t.co/pqewrzn4t3 via @barronsonline
902908242786996224|2017-08-30 09:57:54|Largo|Indian Rocks Beach, FL|United States|null|(27.865251,-82.849182),(27.943275,-82.849182),(27.943275,-82.696478),(27.865251,-82.696478),|@lakewoodch @hlntv no one refused to help hurricane victims. they aare hurricane victims.
902908382713085953|2017-08-30 09:58:28|American Red Cross|Jacksonville, FL|United States|null|(30.31614,-81.676176),(30.31614,-81.676176),(30.31614,-81.676176),(30.31614,-81.676176),|call 1-800-red cross or text harvey to 90999 to make a $10 donation for those in need following the aftermath of… https://t.co/oqnzyzpl2w
902908389889458176|2017-08-30 09:58:30|Riverside|In my season |United States|null|(33.85216,-117.523867),(34.019484,-117.523867),(34.019484,-117.271365),(33.85216,-117.271365),|https://t.co/wckw0cptnl.  please donate! they help the vicitims of harvey the stay behind helping rebuild while spreading the gospel ❤️
902908598082199556|2017-08-30 09:59:19|St Louis Park|null|United States|null|(44.919577,-93.410573),(44.978557,-93.410573),(44.978557,-93.328414),(44.919577,-93.328414),|these fxxk'g climate-denying repulsicans. same ones who denied $ to help with hurricane sandy. https://t.co/tpnxussyj0
902908712880410624|2017-08-30 09:59:47|Ottawa|🇨🇦Canada🇨🇦|Canada|null|(44.961937,-76.353876),(45.535645,-76.353876),(45.535645,-75.246407),(44.961937,-75.246407),|great way to help #hurricaneharvey2017 victims. pls help if you can. if not pls share #hurricaneharveyrelief https://t.co/1mt9lyz20h
902908791242489856|2017-08-30 10:00:05|El Paso|Texas, USA |United States|null|(31.620668,-106.634874),(31.966068,-106.634874),(31.966068,-106.199987),(31.620668,-106.199987),|jj watt mvp for helping out his city where he plays #harvey #houstonstrong
902908852470939648|2017-08-30 10:00:20|St Charles|Charles County, Maryland|United States|null|(38.567334,-76.980974),(38.639709,-76.980974),(38.639709,-76.85926),(38.567334,-76.85926),|our hearts go out to all those forever impacted by #hurricaneharvey. if you'd like to help the relief effort, consi… https://t.co/tvzxh3zajy
902909024869502976|2017-08-30 10:01:01|Brooklyn|New York, NY|United States|null|(40.570842,-74.041878),(40.739434,-74.041878),(40.739434,-73.855673),(40.570842,-73.855673),|full of gratitude this morning, but the victims and effects of hurricane harvey are still heavy on my heart. 🙏🏽❤️#help
902909303799074817|2017-08-30 10:02:07|Pennsylvania|Fallsington, PA|United States|null|(39.719801,-80.519851),(42.516072,-80.519851),(42.516072,-74.689517),(39.719801,-74.689517),|#philly #musicians helping our #texas friends #hurricaneharvey #houston #livemusic check #facebook for more info… https://t.co/rnzivyprfe
902909313685053441|2017-08-30 10:02:10|Palm Beach Gardens|Florida, USA|United States|null|(26.785413,-80.177251),(26.8962,-80.177251),(26.8962,-80.065807),(26.785413,-80.065807),|we are all doing our part to help those in need. if you can contribute, please do! #collierscares #harveyrelief… https://t.co/ydq02maigm
902909321494884352|2017-08-30 10:02:12|Alabama|Tuscaloosa, Alabama|United States|null|(30.144425,-88.473228),(35.008029,-88.473228),(35.008029,-84.888247),(30.144425,-84.888247),|have 2 share how inspired i was yesterday by the #servanthearts of over 50+ @ualawschool students discussing efforts to aid #harvey victims
902909354302595076|2017-08-30 10:02:19|Texas|Lubbock, TX|United States|null|(25.837092,-106.645646),(36.500695,-106.645646),(36.500695,-93.508131),(25.837092,-93.508131),|harvey help! trinity loves big! more details on giving:https://t.co/4vjekyzwdd #trinityfortexas #hurricaneharvey… https://t.co/0ujeauosq4
902909474440187904|2017-08-30 10:02:48|Brooklyn|Brooklyn, NY|United States|null|(40.570842,-74.041878),(40.739434,-74.041878),(40.739434,-73.855673),(40.570842,-73.855673),|here's a way to help out for #thegulfcoast #hurricanharvey https://t.co/dn9a8gkgwb
902909637766389760|2017-08-30 10:03:27|Houston|Houston, TX|United States|null|(29.522325,-95.823268),(30.154665,-95.823268),(30.154665,-95.069705),(29.522325,-95.069705),|open regular hours at montrose & i-10. receive 15% off for donations of personal hygiene and first aid products! #harvey #houstonstrong
902909707265990657|2017-08-30 10:03:44|Texas Oncology|null|United States|null|(32.835475,-97.125845),(32.835475,-97.125845),(32.835475,-97.125845),(32.835475,-97.125845),|please forward to anyone in need of assistance in the houston area. @texasoncology #hurricaneharvey https://t.co/1sz2unqmig
902909878099877888|2017-08-30 10:04:24|Bellingham|Bellingham, Washington|United States|null|(48.689345,-122.546166),(48.81736,-122.546166),(48.81736,-122.314388),(48.689345,-122.314388),|for every cheesesteak you purchase this week, $1 will go to direct relief to help the victims of hurricane harvey.… https://t.co/jugdphurbq
902910029422104576|2017-08-30 10:05:00|Philadelphia|Philadelphia, PA|United States|null|(39.871811,-75.280284),(40.13792,-75.280284),(40.13792,-74.955712),(39.871811,-74.955712),|victim of #hurricaneharvey tells #cnn reporter to help and move microphone out of face. https://t.co/wev3ouypm8
902910029422104576|2017-08-30 10:05:00|Philadelphia|Philadelphia, PA|United States|null|(39.871811,-75.280284),(40.13792,-75.280284),(40.13792,-74.955712),(39.871811,-74.955712),|victim of #hurricaneharvey tells #cnn reporter to help and move microphone out of face. https://t.co/wev3ouypm8
902910127845416961|2017-08-30 10:05:24|Oceanside|Oceanside,Ca.|United States|null|(33.152639,-117.399853),(33.299993,-117.399853),(33.299993,-117.241905),(33.152639,-117.241905),|#harveyflood texas has a history of secession talk. talk presently u.s. gov. help!
902910184611336193|2017-08-30 10:05:37|Florida|null|United States|null|(24.396308,-87.634643),(31.001056,-87.634643),(31.001056,-79.974307),(24.396308,-79.974307),|please join us now live on https://t.co/wqxswrykno to help support the victims of hurricane harvey all this week
902910197827604480|2017-08-30 10:05:41|WFSB Channel 3 Eyewitness News|null|United States|null|(41.647807,-72.662373),(41.647807,-72.662373),(41.647807,-72.662373),(41.647807,-72.662373),|doing our part to help the victims of #harvey .  stop by anytime before 5! https://t.co/ta61tjqdlf
902910266198786048|2017-08-30 10:05:57|Los Angeles|Monrovia, ca|United States|null|(33.704538,-118.668404),(34.337041,-118.668404),(34.337041,-118.155409),(33.704538,-118.155409),|here’s how you can help hurricane victims in texas https://t.co/ytcy5genv8
902910334415069185|2017-08-30 10:06:13|Bayonne|North Jersey |United States|null|(40.643773,-74.146932),(40.697794,-74.146932),(40.697794,-74.0658),(40.643773,-74.0658),|"hope he was helped😥  tv crew finds wet, exhausted possum bracing for harvey | nbc 6 south florida https://t.co/sivka49kb9 via @nbc6"
902910492535951361|2017-08-30 10:06:51|San Diego|San Diego, CA|United States|null|(32.53962,-117.282538),(33.080404,-117.282538),(33.080404,-116.92744),(32.53962,-116.92744),|cleaning out my closet, giving away a lot to send to the victims who've lost everything due to #hurricaneharvey if you want to help inbox me
902910546495905793|2017-08-30 10:07:04|Rocky Hill|null|United States|null|(41.62764,-72.716174),(41.687472,-72.716174),(41.687472,-72.610145),(41.62764,-72.610145),|please give to#harveyrelief so many organizations are posting ontwitter, and many tweets from our twitter family!these people need help now!
902910633443811331|2017-08-30 10:07:24|Texas|San Marcos, TX|United States|29.83139298,-97.99234986|(25.837092,-106.645646),(36.500695,-106.645646),(36.500695,-93.508131),(25.837092,-93.508131),|the guys at sea level apparel are headed to the coast to help with the hurricane relief! if you… https://t.co/m9estwtx55
902910637147348992|2017-08-30 10:07:25|Tennessee|null|United States|null|(34.982924,-90.310298),(36.678119,-90.310298),(36.678119,-81.646901),(34.982924,-81.646901),|where to donate to help #harvey victims #donatehouston #hurricaineharvey  https://t.co/leuwp5n8wr
902910650799734784|2017-08-30 10:07:29|California|Kelowna, BC|United States|null|(32.528832,-124.482003),(42.009519,-124.482003),(42.009519,-114.131212),(32.528832,-114.131212),|please pray for the @irisrelief irisrelief team as the are in houston helping the victims of hurricane harvey
902910820501266440|2017-08-30 10:08:09|Los Angeles|California, USA|United States|null|(33.704538,-118.668404),(34.337041,-118.668404),(34.337041,-118.155409),(33.704538,-118.155409),|⚡️ “sandra bullock pledges $1 million to help harvey victims”  https://t.co/zbqoiajdpq
902910882971361280|2017-08-30 10:08:24|Houston|Houston, TX|United States|null|(29.522325,-95.823268),(30.154665,-95.823268),(30.154665,-95.069705),(29.522325,-95.069705),|mutual assistance crews from other parts of texas, louisiana, florida, kansas, alabama and tennessee are helping restore #harvey outages.
902910965468897280|2017-08-30 10:08:44|California|Green Valley Lake, CA|United States|null|(32.528832,-124.482003),(42.009519,-124.482003),(42.009519,-114.131212),(32.528832,-114.131212),|@realdonaldtrump thank you for reminding us who the real victim is today, sir. #goodlord #whelp #hurricaneharvey
902911054593658880|2017-08-30 10:09:05|Cedar Hill|Dallas, TX|United States|32.64754507,-96.96741594|(32.541286,-97.028288),(32.649242,-97.028288),(32.649242,-96.891039),(32.541286,-96.891039),|#koddallas #houston #harvey #help #care @koddallas @koddallas… https://t.co/kflvjmiyn5
902911063930298368|2017-08-30 10:09:07|Texarkana|Los Angeles|United States|null|(33.361206,-94.151573),(33.500264,-94.151573),(33.500264,-94.042938),(33.361206,-94.042938),|@anheuserbusch trucking cans of water from its georgia brewery to texas to aid #harveystorm victims. these two and… https://t.co/3dv6uhm8r1
